c0609a-s8.ufhpc
Thu Dec 18 10:44:03 AM EST 2025
/orange/ruogu.fang/junfu.cheng/SMILE/ml_exp/hpo_quicklab_version6_hold_out
Workspace: /orange/ruogu.fang/junfu.cheng/SMILE/ml_exp/hpo_quicklab_version6_hold_out
Loading Adult dataset once (same preprocessing pipeline)...
Full dataset: n=48842, positive_rate=0.239, X_shape=(48842, 108)

=== Run 1/40 | sample_size=50 | seed=0 | algo=random ===
[    random] DONE  t=18.0s  evals=271  best_cv=0.78632  params={'max_depth': 5, 'max_leaf_nodes': 99, 'learning_rate': 0.13047920463083068, 'max_bins': 241, 'min_samples_leaf': 7, 'l2_regularization': 0.012431653277368582, 'early_stopping': True, 'validation_fraction': 0.1912173363494999, 'n_estimators': 452}
[countdown] HPO 'random': elapsed 00:18 | remaining budget ~ 00:00
[done] sample_size=50 seed=0 | best_cv=0.78632 | test_acc=0.76923 | run_time=18.1s
[ETA] finished 1/40 | est remaining ~ 11:44

=== Run 2/40 | sample_size=50 | seed=1 | algo=random ===
[    random] DONE  t=18.0s  evals=557  best_cv=0.83761  params={'max_depth': 4, 'max_leaf_nodes': 234, 'learning_rate': 0.02591780449352185, 'max_bins': 36, 'min_samples_leaf': 7, 'l2_regularization': 2.537415949007654, 'early_stopping': False, 'validation_fraction': 0.24056259463020052, 'n_estimators': 456}
[countdown] HPO 'random': elapsed 00:18 | remaining budget ~ 00:00
[done] sample_size=50 seed=1 | best_cv=0.83761 | test_acc=0.69231 | run_time=18.1s
[ETA] finished 2/40 | est remaining ~ 11:26

=== Run 3/40 | sample_size=50 | seed=2 | algo=random ===
[    random] DONE  t=18.0s  evals=567  best_cv=0.86538  params={'max_depth': 4, 'max_leaf_nodes': 177, 'learning_rate': 0.05698856795643569, 'max_bins': 101, 'min_samples_leaf': 9, 'l2_regularization': 3.167805915329382e-05, 'early_stopping': False, 'validation_fraction': 0.11536902214961474, 'n_estimators': 845}
[countdown] HPO 'random': elapsed 00:18 | remaining budget ~ 00:00
[done] sample_size=50 seed=2 | best_cv=0.86538 | test_acc=0.53846 | run_time=18.2s
[ETA] finished 3/40 | est remaining ~ 11:09

=== Run 4/40 | sample_size=50 | seed=3 | algo=random ===
[    random] DONE  t=18.0s  evals=541  best_cv=0.89316  params={'max_depth': 4, 'max_leaf_nodes': 70, 'learning_rate': 0.28348018882696097, 'max_bins': 117, 'min_samples_leaf': 8, 'l2_regularization': 0.0022897288252675934, 'early_stopping': False, 'validation_fraction': 0.2046556792325358, 'n_estimators': 455}
[countdown] HPO 'random': elapsed 00:18 | remaining budget ~ 00:00
[done] sample_size=50 seed=3 | best_cv=0.89316 | test_acc=0.69231 | run_time=18.1s
[ETA] finished 4/40 | est remaining ~ 10:51

=== Run 5/40 | sample_size=50 | seed=4 | algo=random ===
[    random] DONE  t=18.0s  evals=566  best_cv=0.86538  params={'max_depth': 6, 'max_leaf_nodes': 146, 'learning_rate': 0.09760632683786424, 'max_bins': 88, 'min_samples_leaf': 8, 'l2_regularization': 0.0032196459315886063, 'early_stopping': False, 'validation_fraction': 0.1372534537040776, 'n_estimators': 687}
[countdown] HPO 'random': elapsed 00:18 | remaining budget ~ 00:00
[done] sample_size=50 seed=4 | best_cv=0.86538 | test_acc=0.76923 | run_time=18.1s
[ETA] finished 5/40 | est remaining ~ 10:33

--- Aggregate for this sample size ---
sample_size=50 | test_acc mean=0.69231 std=0.09421 sem=0.04213

=== Run 6/40 | sample_size=500 | seed=0 | algo=random ===
[    random] DONE  t=18.0s  evals=194  best_cv=0.85067  params={'max_depth': 5, 'max_leaf_nodes': 99, 'learning_rate': 0.13047920463083068, 'max_bins': 241, 'min_samples_leaf': 7, 'l2_regularization': 0.012431653277368582, 'early_stopping': True, 'validation_fraction': 0.1912173363494999, 'n_estimators': 452}
[countdown] HPO 'random': elapsed 00:18 | remaining budget ~ 00:00
[done] sample_size=500 seed=0 | best_cv=0.85067 | test_acc=0.80800 | run_time=18.0s
[ETA] finished 6/40 | est remaining ~ 10:14

=== Run 7/40 | sample_size=500 | seed=1 | algo=random ===
[    random] DONE  t=18.1s  evals=187  best_cv=0.82133  params={'max_depth': 7, 'max_leaf_nodes': 96, 'learning_rate': 0.004191606738744489, 'max_bins': 167, 'min_samples_leaf': 17, 'l2_regularization': 0.00034064170784122675, 'early_stopping': True, 'validation_fraction': 0.0847586961942945, 'n_estimators': 508}
[countdown] HPO 'random': elapsed 00:18 | remaining budget ~ 00:00
[done] sample_size=500 seed=1 | best_cv=0.82133 | test_acc=0.83200 | run_time=18.2s
[ETA] finished 7/40 | est remaining ~ 09:57

=== Run 8/40 | sample_size=500 | seed=2 | algo=random ===
[    random] DONE  t=18.2s  evals=184  best_cv=0.82667  params={'max_depth': 10, 'max_leaf_nodes': 203, 'learning_rate': 0.05706739960860087, 'max_bins': 103, 'min_samples_leaf': 11, 'l2_regularization': 1.6054769381876793e-06, 'early_stopping': True, 'validation_fraction': 0.08233167649973634, 'n_estimators': 245}
[countdown] HPO 'random': elapsed 00:18 | remaining budget ~ 00:00
[done] sample_size=500 seed=2 | best_cv=0.82667 | test_acc=0.82400 | run_time=18.2s
[ETA] finished 8/40 | est remaining ~ 09:39

=== Run 9/40 | sample_size=500 | seed=3 | algo=random ===
[    random] DONE  t=18.1s  evals=178  best_cv=0.81867  params={'max_depth': 12, 'max_leaf_nodes': 28, 'learning_rate': 0.10438864069760899, 'max_bins': 106, 'min_samples_leaf': 75, 'l2_regularization': 7.396266537831289, 'early_stopping': False, 'validation_fraction': 0.24731627950988494, 'n_estimators': 407}
[countdown] HPO 'random': elapsed 00:18 | remaining budget ~ 00:00
[done] sample_size=500 seed=3 | best_cv=0.81867 | test_acc=0.84000 | run_time=18.2s
[ETA] finished 9/40 | est remaining ~ 09:22

=== Run 10/40 | sample_size=500 | seed=4 | algo=random ===
[    random] DONE  t=18.2s  evals=192  best_cv=0.84800  params={'max_depth': 7, 'max_leaf_nodes': 75, 'learning_rate': 0.008113626264214507, 'max_bins': 253, 'min_samples_leaf': 54, 'l2_regularization': 3.7437718945914367, 'early_stopping': False, 'validation_fraction': 0.14592327543288358, 'n_estimators': 648}
[countdown] HPO 'random': elapsed 00:18 | remaining budget ~ 00:00
[done] sample_size=500 seed=4 | best_cv=0.84800 | test_acc=0.81600 | run_time=18.4s
[ETA] finished 10/40 | est remaining ~ 09:04

--- Aggregate for this sample size ---
sample_size=500 | test_acc mean=0.82400 std=0.01265 sem=0.00566

=== Run 11/40 | sample_size=1000 | seed=0 | algo=random ===
[    random] DONE  t=18.2s  evals=95  best_cv=0.85067  params={'max_depth': 5, 'max_leaf_nodes': 89, 'learning_rate': 0.008534042748517427, 'max_bins': 201, 'min_samples_leaf': 16, 'l2_regularization': 1.0637075056950944, 'early_stopping': True, 'validation_fraction': 0.14845029204696625, 'n_estimators': 819}
[countdown] HPO 'random': elapsed 00:18 | remaining budget ~ 00:00
[done] sample_size=1000 seed=0 | best_cv=0.85067 | test_acc=0.84800 | run_time=18.6s
[ETA] finished 11/40 | est remaining ~ 08:47

=== Run 12/40 | sample_size=1000 | seed=1 | algo=random ===
[    random] DONE  t=18.0s  evals=95  best_cv=0.84667  params={'max_depth': 4, 'max_leaf_nodes': 36, 'learning_rate': 0.14797734328448847, 'max_bins': 147, 'min_samples_leaf': 8, 'l2_regularization': 0.19011526799871842, 'early_stopping': False, 'validation_fraction': 0.1123898064133557, 'n_estimators': 212}
[countdown] HPO 'random': elapsed 00:18 | remaining budget ~ 00:00
[done] sample_size=1000 seed=1 | best_cv=0.84667 | test_acc=0.84800 | run_time=18.2s
[ETA] finished 12/40 | est remaining ~ 08:29

=== Run 13/40 | sample_size=1000 | seed=2 | algo=random ===
[    random] DONE  t=18.3s  evals=90  best_cv=0.84400  params={'max_depth': 5, 'max_leaf_nodes': 116, 'learning_rate': 0.006084505040393321, 'max_bins': 108, 'min_samples_leaf': 30, 'l2_regularization': 0.008654446290659578, 'early_stopping': False, 'validation_fraction': 0.11809291855331368, 'n_estimators': 640}
[countdown] HPO 'random': elapsed 00:18 | remaining budget ~ 00:00
[done] sample_size=1000 seed=2 | best_cv=0.84400 | test_acc=0.87600 | run_time=18.8s
[ETA] finished 13/40 | est remaining ~ 08:12

=== Run 14/40 | sample_size=1000 | seed=3 | algo=random ===
[    random] DONE  t=18.0s  evals=82  best_cv=0.84800  params={'max_depth': 3, 'max_leaf_nodes': 107, 'learning_rate': 0.03514447088142163, 'max_bins': 161, 'min_samples_leaf': 24, 'l2_regularization': 0.0030916299204506816, 'early_stopping': True, 'validation_fraction': 0.28245564352653324, 'n_estimators': 430}
[countdown] HPO 'random': elapsed 00:18 | remaining budget ~ 00:00
[done] sample_size=1000 seed=3 | best_cv=0.84800 | test_acc=0.83600 | run_time=18.1s
[ETA] finished 14/40 | est remaining ~ 07:54

=== Run 15/40 | sample_size=1000 | seed=4 | algo=random ===
[    random] DONE  t=18.1s  evals=106  best_cv=0.83333  params={'max_depth': 11, 'max_leaf_nodes': 57, 'learning_rate': 0.008491948666972027, 'max_bins': 73, 'min_samples_leaf': 50, 'l2_regularization': 0.08852722329031582, 'early_stopping': False, 'validation_fraction': 0.1735638071965825, 'n_estimators': 446}
[countdown] HPO 'random': elapsed 00:18 | remaining budget ~ 00:00
[done] sample_size=1000 seed=4 | best_cv=0.83333 | test_acc=0.84400 | run_time=18.5s
[ETA] finished 15/40 | est remaining ~ 07:36

--- Aggregate for this sample size ---
sample_size=1000 | test_acc mean=0.85040 std=0.01513 sem=0.00676

=== Run 16/40 | sample_size=2000 | seed=0 | algo=random ===
[    random] DONE  t=18.0s  evals=42  best_cv=0.83333  params={'max_depth': 6, 'max_leaf_nodes': 249, 'learning_rate': 0.02622870518247891, 'max_bins': 93, 'min_samples_leaf': 41, 'l2_regularization': 0.41904077564264564, 'early_stopping': False, 'validation_fraction': 0.07280398845755646, 'n_estimators': 427}
[countdown] HPO 'random': elapsed 00:18 | remaining budget ~ 00:00
[done] sample_size=2000 seed=0 | best_cv=0.83333 | test_acc=0.85200 | run_time=18.5s
[ETA] finished 16/40 | est remaining ~ 07:18

=== Run 17/40 | sample_size=2000 | seed=1 | algo=random ===
[    random] DONE  t=18.5s  evals=39  best_cv=0.84800  params={'max_depth': 4, 'max_leaf_nodes': 36, 'learning_rate': 0.14797734328448847, 'max_bins': 147, 'min_samples_leaf': 8, 'l2_regularization': 0.19011526799871842, 'early_stopping': False, 'validation_fraction': 0.1123898064133557, 'n_estimators': 212}
[countdown] HPO 'random': elapsed 00:18 | remaining budget ~ 00:00
[done] sample_size=2000 seed=1 | best_cv=0.84800 | test_acc=0.84800 | run_time=18.7s
[ETA] finished 17/40 | est remaining ~ 07:00

=== Run 18/40 | sample_size=2000 | seed=2 | algo=random ===
[    random] DONE  t=18.3s  evals=35  best_cv=0.85933  params={'max_depth': 4, 'max_leaf_nodes': 21, 'learning_rate': 0.013169056275515756, 'max_bins': 255, 'min_samples_leaf': 37, 'l2_regularization': 0.004246222440375763, 'early_stopping': False, 'validation_fraction': 0.17173043287322426, 'n_estimators': 435}
[countdown] HPO 'random': elapsed 00:18 | remaining budget ~ 00:00
[done] sample_size=2000 seed=2 | best_cv=0.85933 | test_acc=0.87200 | run_time=18.8s
[ETA] finished 18/40 | est remaining ~ 06:43

=== Run 19/40 | sample_size=2000 | seed=3 | algo=random ===
[    random] DONE  t=18.2s  evals=33  best_cv=0.85600  params={'max_depth': 7, 'max_leaf_nodes': 148, 'learning_rate': 0.005721143543817202, 'max_bins': 118, 'min_samples_leaf': 7, 'l2_regularization': 0.33019862559534535, 'early_stopping': False, 'validation_fraction': 0.05501322257614984, 'n_estimators': 730}
[countdown] HPO 'random': elapsed 00:18 | remaining budget ~ 00:00
[done] sample_size=2000 seed=3 | best_cv=0.85600 | test_acc=0.86400 | run_time=19.6s
[ETA] finished 19/40 | est remaining ~ 06:26

=== Run 20/40 | sample_size=2000 | seed=4 | algo=random ===
[    random] DONE  t=18.6s  evals=39  best_cv=0.83333  params={'max_depth': 3, 'max_leaf_nodes': 141, 'learning_rate': 0.009304257572954878, 'max_bins': 142, 'min_samples_leaf': 58, 'l2_regularization': 3.232168105819514, 'early_stopping': True, 'validation_fraction': 0.13414739611783005, 'n_estimators': 772}
[countdown] HPO 'random': elapsed 00:18 | remaining budget ~ 00:00
[done] sample_size=2000 seed=4 | best_cv=0.83333 | test_acc=0.86400 | run_time=19.2s
[ETA] finished 20/40 | est remaining ~ 06:08

--- Aggregate for this sample size ---
sample_size=2000 | test_acc mean=0.86000 std=0.00980 sem=0.00438

=== Run 21/40 | sample_size=5000 | seed=0 | algo=random ===
[    random] DONE  t=18.6s  evals=20  best_cv=0.84960  params={'max_depth': 6, 'max_leaf_nodes': 249, 'learning_rate': 0.02622870518247891, 'max_bins': 93, 'min_samples_leaf': 41, 'l2_regularization': 0.41904077564264564, 'early_stopping': False, 'validation_fraction': 0.07280398845755646, 'n_estimators': 427}
[countdown] HPO 'random': elapsed 00:18 | remaining budget ~ 00:00
[done] sample_size=5000 seed=0 | best_cv=0.84960 | test_acc=0.86160 | run_time=19.6s
[ETA] finished 21/40 | est remaining ~ 05:51

=== Run 22/40 | sample_size=5000 | seed=1 | algo=random ===
[    random] DONE  t=18.7s  evals=19  best_cv=0.85627  params={'max_depth': 12, 'max_leaf_nodes': 166, 'learning_rate': 0.02788943802317153, 'max_bins': 197, 'min_samples_leaf': 48, 'l2_regularization': 1.514119244095972e-05, 'early_stopping': True, 'validation_fraction': 0.2955191593846336, 'n_estimators': 889}
[countdown] HPO 'random': elapsed 00:18 | remaining budget ~ 00:00
[done] sample_size=5000 seed=1 | best_cv=0.85627 | test_acc=0.86000 | run_time=19.1s
[ETA] finished 22/40 | est remaining ~ 05:33

=== Run 23/40 | sample_size=5000 | seed=2 | algo=random ===
[    random] DONE  t=18.3s  evals=15  best_cv=0.86320  params={'max_depth': 11, 'max_leaf_nodes': 57, 'learning_rate': 0.025192768887245188, 'max_bins': 92, 'min_samples_leaf': 64, 'l2_regularization': 1.4689484455380782e-06, 'early_stopping': False, 'validation_fraction': 0.09339718844126423, 'n_estimators': 622}
[countdown] HPO 'random': elapsed 00:18 | remaining budget ~ 00:00
[done] sample_size=5000 seed=2 | best_cv=0.86320 | test_acc=0.87200 | run_time=20.3s
[ETA] finished 23/40 | est remaining ~ 05:16

=== Run 24/40 | sample_size=5000 | seed=3 | algo=random ===
[    random] DONE  t=19.5s  evals=18  best_cv=0.86080  params={'max_depth': 3, 'max_leaf_nodes': 90, 'learning_rate': 0.011691073850061314, 'max_bins': 138, 'min_samples_leaf': 35, 'l2_regularization': 2.0385925272308177e-06, 'early_stopping': True, 'validation_fraction': 0.1444511922419825, 'n_estimators': 700}
[countdown] HPO 'random': elapsed 00:19 | remaining budget ~ 00:00
[done] sample_size=5000 seed=3 | best_cv=0.86080 | test_acc=0.85040 | run_time=20.7s
[ETA] finished 24/40 | est remaining ~ 04:58

=== Run 25/40 | sample_size=5000 | seed=4 | algo=random ===
[    random] DONE  t=18.8s  evals=22  best_cv=0.85280  params={'max_depth': 3, 'max_leaf_nodes': 141, 'learning_rate': 0.009304257572954878, 'max_bins': 142, 'min_samples_leaf': 58, 'l2_regularization': 3.232168105819514, 'early_stopping': True, 'validation_fraction': 0.13414739611783005, 'n_estimators': 772}
[countdown] HPO 'random': elapsed 00:18 | remaining budget ~ 00:00
[done] sample_size=5000 seed=4 | best_cv=0.85280 | test_acc=0.85920 | run_time=20.2s
[ETA] finished 25/40 | est remaining ~ 04:41

--- Aggregate for this sample size ---
sample_size=5000 | test_acc mean=0.86064 std=0.00770 sem=0.00344

=== Run 26/40 | sample_size=10000 | seed=0 | algo=random ===
[    random] DONE  t=18.1s  evals=10  best_cv=0.86120  params={'max_depth': 6, 'max_leaf_nodes': 249, 'learning_rate': 0.02622870518247891, 'max_bins': 93, 'min_samples_leaf': 41, 'l2_regularization': 0.41904077564264564, 'early_stopping': False, 'validation_fraction': 0.07280398845755646, 'n_estimators': 427}
[countdown] HPO 'random': elapsed 00:18 | remaining budget ~ 00:00
[done] sample_size=10000 seed=0 | best_cv=0.86120 | test_acc=0.85400 | run_time=20.1s
[ETA] finished 26/40 | est remaining ~ 04:23

=== Run 27/40 | sample_size=10000 | seed=1 | algo=random ===
[    random] DONE  t=20.8s  evals=9  best_cv=0.86173  params={'max_depth': 6, 'max_leaf_nodes': 210, 'learning_rate': 0.01243709592938239, 'max_bins': 158, 'min_samples_leaf': 146, 'l2_regularization': 4.281452713339007e-05, 'early_stopping': True, 'validation_fraction': 0.2192121349624936, 'n_estimators': 879}
[countdown] HPO 'random': elapsed 00:20 | remaining budget ~ 00:00
[done] sample_size=10000 seed=1 | best_cv=0.86173 | test_acc=0.86600 | run_time=24.2s
[ETA] finished 27/40 | est remaining ~ 04:07

=== Run 28/40 | sample_size=10000 | seed=2 | algo=random ===
[    random] DONE  t=20.3s  evals=7  best_cv=0.86093  params={'max_depth': 11, 'max_leaf_nodes': 57, 'learning_rate': 0.025192768887245188, 'max_bins': 92, 'min_samples_leaf': 64, 'l2_regularization': 1.4689484455380782e-06, 'early_stopping': False, 'validation_fraction': 0.09339718844126423, 'n_estimators': 622}
[countdown] HPO 'random': elapsed 00:20 | remaining budget ~ 00:00
[done] sample_size=10000 seed=2 | best_cv=0.86093 | test_acc=0.86320 | run_time=24.3s
[ETA] finished 28/40 | est remaining ~ 03:50

=== Run 29/40 | sample_size=10000 | seed=3 | algo=random ===
[    random] DONE  t=18.8s  evals=8  best_cv=0.85600  params={'max_depth': 5, 'max_leaf_nodes': 74, 'learning_rate': 0.038650191113368024, 'max_bins': 254, 'min_samples_leaf': 138, 'l2_regularization': 0.000536484336043741, 'early_stopping': True, 'validation_fraction': 0.21785286884239813, 'n_estimators': 165}
[countdown] HPO 'random': elapsed 00:18 | remaining budget ~ 00:00
[done] sample_size=10000 seed=3 | best_cv=0.85600 | test_acc=0.86680 | run_time=19.5s
[ETA] finished 29/40 | est remaining ~ 03:31

=== Run 30/40 | sample_size=10000 | seed=4 | algo=random ===
[    random] DONE  t=19.4s  evals=11  best_cv=0.86333  params={'max_depth': 7, 'max_leaf_nodes': 147, 'learning_rate': 0.021704734971546503, 'max_bins': 152, 'min_samples_leaf': 184, 'l2_regularization': 0.00025113246410495466, 'early_stopping': True, 'validation_fraction': 0.06660961734651523, 'n_estimators': 307}
[countdown] HPO 'random': elapsed 00:19 | remaining budget ~ 00:00
[done] sample_size=10000 seed=4 | best_cv=0.86333 | test_acc=0.85440 | run_time=20.6s
[ETA] finished 30/40 | est remaining ~ 03:12

--- Aggregate for this sample size ---
sample_size=10000 | test_acc mean=0.86088 std=0.00624 sem=0.00279

=== Run 31/40 | sample_size=20000 | seed=0 | algo=random ===
[    random] DONE  t=18.3s  evals=5  best_cv=0.86013  params={'max_depth': 8, 'max_leaf_nodes': 135, 'learning_rate': 0.025091937524765618, 'max_bins': 122, 'min_samples_leaf': 116, 'l2_regularization': 0.00016344697852982608, 'early_stopping': True, 'validation_fraction': 0.2916515919426897, 'n_estimators': 588}
[countdown] HPO 'random': elapsed 00:18 | remaining budget ~ 00:00
[done] sample_size=20000 seed=0 | best_cv=0.86013 | test_acc=0.86800 | run_time=22.5s
[ETA] finished 31/40 | est remaining ~ 02:54

=== Run 32/40 | sample_size=20000 | seed=1 | algo=random ===
[    random] DONE  t=21.7s  evals=5  best_cv=0.86427  params={'max_depth': 9, 'max_leaf_nodes': 216, 'learning_rate': 0.0033487830741156573, 'max_bins': 156, 'min_samples_leaf': 12, 'l2_regularization': 1.7915102525115658, 'early_stopping': False, 'validation_fraction': 0.15819176697626336, 'n_estimators': 880}
[countdown] HPO 'random': elapsed 00:21 | remaining budget ~ 00:00
[done] sample_size=20000 seed=1 | best_cv=0.86427 | test_acc=0.86480 | run_time=35.8s
[ETA] finished 32/40 | est remaining ~ 02:38

=== Run 33/40 | sample_size=20000 | seed=2 | algo=random ===
[    random] DONE  t=24.5s  evals=5  best_cv=0.85993  params={'max_depth': 11, 'max_leaf_nodes': 57, 'learning_rate': 0.025192768887245188, 'max_bins': 92, 'min_samples_leaf': 64, 'l2_regularization': 1.4689484455380782e-06, 'early_stopping': False, 'validation_fraction': 0.09339718844126423, 'n_estimators': 622}
[countdown] HPO 'random': elapsed 00:24 | remaining budget ~ 00:00
[done] sample_size=20000 seed=2 | best_cv=0.85993 | test_acc=0.86620 | run_time=31.3s
[ETA] finished 33/40 | est remaining ~ 02:21

=== Run 34/40 | sample_size=20000 | seed=3 | algo=random ===
[    random] DONE  t=18.6s  evals=5  best_cv=0.86720  params={'max_depth': 9, 'max_leaf_nodes': 197, 'learning_rate': 0.09338392790868287, 'max_bins': 141, 'min_samples_leaf': 106, 'l2_regularization': 0.12499188317909446, 'early_stopping': False, 'validation_fraction': 0.29102343793136387, 'n_estimators': 237}
[countdown] HPO 'random': elapsed 00:18 | remaining budget ~ 00:00
[done] sample_size=20000 seed=3 | best_cv=0.86720 | test_acc=0.86760 | run_time=20.9s
[ETA] finished 34/40 | est remaining ~ 02:01

=== Run 35/40 | sample_size=20000 | seed=4 | algo=random ===
[    random] DONE  t=18.2s  evals=5  best_cv=0.85567  params={'max_depth': 6, 'max_leaf_nodes': 60, 'learning_rate': 0.004152460886758944, 'max_bins': 103, 'min_samples_leaf': 27, 'l2_regularization': 4.093026271018126, 'early_stopping': False, 'validation_fraction': 0.05180283358110167, 'n_estimators': 398}
[countdown] HPO 'random': elapsed 00:18 | remaining budget ~ 00:00
[done] sample_size=20000 seed=4 | best_cv=0.85567 | test_acc=0.85920 | run_time=22.7s
[ETA] finished 35/40 | est remaining ~ 01:41

--- Aggregate for this sample size ---
sample_size=20000 | test_acc mean=0.86516 std=0.00356 sem=0.00159

=== Run 36/40 | sample_size=40000 | seed=0 | algo=random ===
[    random] DONE  t=22.7s  evals=2  best_cv=0.86230  params={'max_depth': 7, 'max_leaf_nodes': 137, 'learning_rate': 0.007854588488222852, 'max_bins': 87, 'min_samples_leaf': 134, 'l2_regularization': 9.438781581276865e-06, 'early_stopping': True, 'validation_fraction': 0.23895105103930597, 'n_estimators': 733}
[countdown] HPO 'random': elapsed 00:22 | remaining budget ~ 00:00
[done] sample_size=40000 seed=0 | best_cv=0.86230 | test_acc=0.86340 | run_time=35.5s
[ETA] finished 36/40 | est remaining ~ 01:22

=== Run 37/40 | sample_size=40000 | seed=1 | algo=random ===
[    random] DONE  t=25.5s  evals=2  best_cv=0.86437  params={'max_depth': 9, 'max_leaf_nodes': 216, 'learning_rate': 0.0033487830741156573, 'max_bins': 156, 'min_samples_leaf': 12, 'l2_regularization': 1.7915102525115658, 'early_stopping': False, 'validation_fraction': 0.15819176697626336, 'n_estimators': 880}
[countdown] HPO 'random': elapsed 00:25 | remaining budget ~ 00:00
[done] sample_size=40000 seed=1 | best_cv=0.86437 | test_acc=0.87240 | run_time=52.7s
[ETA] finished 37/40 | est remaining ~ 01:04

=== Run 38/40 | sample_size=40000 | seed=2 | algo=random ===
[    random] DONE  t=20.3s  evals=3  best_cv=0.86083  params={'max_depth': 12, 'max_leaf_nodes': 24, 'learning_rate': 0.028379846542489318, 'max_bins': 72, 'min_samples_leaf': 115, 'l2_regularization': 0.02946451974488588, 'early_stopping': False, 'validation_fraction': 0.1860442618573302, 'n_estimators': 555}
[countdown] HPO 'random': elapsed 00:20 | remaining budget ~ 00:00
[done] sample_size=40000 seed=2 | best_cv=0.86083 | test_acc=0.86240 | run_time=30.4s
[ETA] finished 38/40 | est remaining ~ 00:43

=== Run 39/40 | sample_size=40000 | seed=3 | algo=random ===
[    random] DONE  t=23.3s  evals=2  best_cv=0.87020  params={'max_depth': 6, 'max_leaf_nodes': 166, 'learning_rate': 0.02293892509450154, 'max_bins': 126, 'min_samples_leaf': 159, 'l2_regularization': 0.002081492046825628, 'early_stopping': True, 'validation_fraction': 0.2013998825348317, 'n_estimators': 957}
[countdown] HPO 'random': elapsed 00:23 | remaining budget ~ 00:00
[done] sample_size=40000 seed=3 | best_cv=0.87020 | test_acc=0.87330 | run_time=36.0s
[ETA] finished 39/40 | est remaining ~ 00:22

=== Run 40/40 | sample_size=40000 | seed=4 | algo=random ===
[    random] DONE  t=19.9s  evals=3  best_cv=0.85037  params={'max_depth': 6, 'max_leaf_nodes': 92, 'learning_rate': 0.0018109859691618404, 'max_bins': 133, 'min_samples_leaf': 127, 'l2_regularization': 1.2156425576670132e-05, 'early_stopping': True, 'validation_fraction': 0.054954294118268424, 'n_estimators': 662}
[countdown] HPO 'random': elapsed 00:19 | remaining budget ~ 00:00
[done] sample_size=40000 seed=4 | best_cv=0.85037 | test_acc=0.85480 | run_time=35.6s
[ETA] finished 40/40 | est remaining ~ 00:00

--- Aggregate for this sample size ---
sample_size=40000 | test_acc mean=0.86526 std=0.00769 sem=0.00344

==============================
FINAL SUMMARY (TEST performance after HPO)
==============================
sample_size   n_train   n_test  repeats      mean       std       sem
---------------------------------------------------------------------
        50        38       12        5   0.69231   0.09421   0.04213
       500       375      125        5   0.82400   0.01265   0.00566
      1000       750      250        5   0.85040   0.01513   0.00676
      2000      1500      500        5   0.86000   0.00980   0.00438
      5000      3750     1250        5   0.86064   0.00770   0.00344
     10000      7500     2500        5   0.86088   0.00624   0.00279
     20000     15000     5000        5   0.86516   0.00356   0.00159
     40000     30000    10000        5   0.86526   0.00769   0.00344

Wrote results to: __experi_21278842_output/sample_size_hpo_results.csv
Total elapsed: 15.0 min
Thu Dec 18 10:59:10 AM EST 2025
Job 21278842 finished.
