c0602a-s3.ufhpc
Thu Dec 18 11:51:10 AM EST 2025
/orange/ruogu.fang/junfu.cheng/SMILE/ml_exp/hpo_quicklab_version7_hold_out
Workspace: /orange/ruogu.fang/junfu.cheng/SMILE/ml_exp/hpo_quicklab_version7_hold_out
Loading Adult dataset once (same preprocessing pipeline)...
Full dataset: n=48842 | pos_rate=0.239 | X_shape=(48842, 108)

==============================
Repetitions R = 1
==============================

--- Run 1/40 | n=50 | seed=0 | R=1 ---
[    random] DONE  t=18.0s  evals=276  best_cv=0.80983  params={'max_depth': 4, 'max_leaf_nodes': 84, 'learning_rate': 0.16191796869827138, 'max_bins': 42, 'min_samples_leaf': 5, 'l2_regularization': 6.25216928335074e-05, 'early_stopping': False, 'validation_fraction': 0.16114613730838845, 'n_estimators': 864}
[countdown] elapsed 00:18 | remaining budget ~ 00:00
[done] seed=0 R=1 | best_cv=0.80983 evals=276 | test_acc=0.69231 | run_time=18.1s
[ETA] finished 1/40 | est remaining ~ 11:47

--- Run 2/40 | n=50 | seed=1 | R=1 ---
[    random] DONE  t=18.0s  evals=553  best_cv=0.92094  params={'max_depth': 6, 'max_leaf_nodes': 87, 'learning_rate': 0.048271973945581824, 'max_bins': 206, 'min_samples_leaf': 6, 'l2_regularization': 0.49431628087041873, 'early_stopping': False, 'validation_fraction': 0.07976554338902382, 'n_estimators': 489}
[countdown] elapsed 00:18 | remaining budget ~ 00:00
[done] seed=1 R=1 | best_cv=0.92094 evals=553 | test_acc=0.76923 | run_time=18.1s
[ETA] finished 2/40 | est remaining ~ 11:29

--- Run 3/40 | n=50 | seed=2 | R=1 ---
[    random] DONE  t=18.0s  evals=555  best_cv=0.78419  params={'max_depth': 11, 'max_leaf_nodes': 196, 'learning_rate': 0.09935751091452641, 'max_bins': 105, 'min_samples_leaf': 11, 'l2_regularization': 0.006740865956824171, 'early_stopping': True, 'validation_fraction': 0.06944910998828653, 'n_estimators': 228}
[countdown] elapsed 00:18 | remaining budget ~ 00:00
[done] seed=2 R=1 | best_cv=0.78419 evals=555 | test_acc=0.76923 | run_time=18.0s
[ETA] finished 3/40 | est remaining ~ 11:09

--- Run 4/40 | n=50 | seed=3 | R=1 ---
[    random] DONE  t=18.0s  evals=546  best_cv=0.89316  params={'max_depth': 11, 'max_leaf_nodes': 41, 'learning_rate': 0.10691828810378813, 'max_bins': 215, 'min_samples_leaf': 6, 'l2_regularization': 0.0020645880894026216, 'early_stopping': True, 'validation_fraction': 0.24357600508010674, 'n_estimators': 145}
[countdown] elapsed 00:18 | remaining budget ~ 00:00
[done] seed=3 R=1 | best_cv=0.89316 evals=546 | test_acc=0.76923 | run_time=18.0s
[ETA] finished 4/40 | est remaining ~ 10:50

--- Run 5/40 | n=50 | seed=4 | R=1 ---
[    random] DONE  t=18.0s  evals=578  best_cv=0.75641  params={'max_depth': 6, 'max_leaf_nodes': 92, 'learning_rate': 0.0018109859691618404, 'max_bins': 133, 'min_samples_leaf': 127, 'l2_regularization': 1.2156425576670132e-05, 'early_stopping': True, 'validation_fraction': 0.054954294118268424, 'n_estimators': 662}
[countdown] elapsed 00:18 | remaining budget ~ 00:00
[done] seed=4 R=1 | best_cv=0.75641 evals=578 | test_acc=0.76923 | run_time=18.1s
[ETA] finished 5/40 | est remaining ~ 10:32

--- Run 6/40 | n=50 | seed=5 | R=1 ---
[    random] DONE  t=18.0s  evals=566  best_cv=0.86752  params={'max_depth': 3, 'max_leaf_nodes': 152, 'learning_rate': 0.07062935996636745, 'max_bins': 208, 'min_samples_leaf': 10, 'l2_regularization': 2.2474727776362946e-05, 'early_stopping': False, 'validation_fraction': 0.28380449440095046, 'n_estimators': 436}
[countdown] elapsed 00:18 | remaining budget ~ 00:00
[done] seed=5 R=1 | best_cv=0.86752 evals=566 | test_acc=0.69231 | run_time=18.1s
[ETA] finished 6/40 | est remaining ~ 10:14

--- Run 7/40 | n=50 | seed=6 | R=1 ---
[    random] DONE  t=18.0s  evals=598  best_cv=0.75641  params={'max_depth': 12, 'max_leaf_nodes': 225, 'learning_rate': 0.0015900983178871216, 'max_bins': 227, 'min_samples_leaf': 71, 'l2_regularization': 1.8103360759547454e-06, 'early_stopping': True, 'validation_fraction': 0.21570464072094192, 'n_estimators': 581}
[countdown] elapsed 00:18 | remaining budget ~ 00:00
[done] seed=6 R=1 | best_cv=0.75641 evals=598 | test_acc=0.76923 | run_time=18.0s
[ETA] finished 7/40 | est remaining ~ 09:56

--- Run 8/40 | n=50 | seed=7 | R=1 ---
[    random] DONE  t=18.1s  evals=598  best_cv=0.89103  params={'max_depth': 10, 'max_leaf_nodes': 244, 'learning_rate': 0.15501120092754306, 'max_bins': 132, 'min_samples_leaf': 11, 'l2_regularization': 1.2985446363624275e-05, 'early_stopping': False, 'validation_fraction': 0.2203970291665947, 'n_estimators': 515}
[countdown] elapsed 00:18 | remaining budget ~ 00:00
[done] seed=7 R=1 | best_cv=0.89103 evals=598 | test_acc=0.53846 | run_time=18.1s
[ETA] finished 8/40 | est remaining ~ 09:38

--- Run 9/40 | n=50 | seed=8 | R=1 ---
[    random] DONE  t=18.0s  evals=585  best_cv=0.75641  params={'max_depth': 6, 'max_leaf_nodes': 109, 'learning_rate': 0.25452918657433315, 'max_bins': 64, 'min_samples_leaf': 54, 'l2_regularization': 0.08584568296385033, 'early_stopping': True, 'validation_fraction': 0.08421075315669362, 'n_estimators': 930}
[countdown] elapsed 00:18 | remaining budget ~ 00:00
[done] seed=8 R=1 | best_cv=0.75641 evals=585 | test_acc=0.76923 | run_time=18.0s
[ETA] finished 9/40 | est remaining ~ 09:20

--- Run 10/40 | n=50 | seed=9 | R=1 ---
[    random] DONE  t=18.0s  evals=572  best_cv=0.89316  params={'max_depth': 6, 'max_leaf_nodes': 42, 'learning_rate': 0.05396480569404951, 'max_bins': 150, 'min_samples_leaf': 5, 'l2_regularization': 3.700767716495751e-06, 'early_stopping': False, 'validation_fraction': 0.10878277681279057, 'n_estimators': 655}
[countdown] elapsed 00:18 | remaining budget ~ 00:00
[done] seed=9 R=1 | best_cv=0.89316 evals=572 | test_acc=0.76923 | run_time=18.1s
[ETA] finished 10/40 | est remaining ~ 09:02

[aggregate]
R=1 | test_acc mean=0.73077 std=0.07476 sem=0.02364

==============================
Repetitions R = 3
==============================

--- Run 11/40 | n=50 | seed=0 | R=3 ---
[    random] DONE  t=18.0s  evals=192  best_cv=0.79060  params={'max_depth': 4, 'max_leaf_nodes': 84, 'learning_rate': 0.16191796869827138, 'max_bins': 42, 'min_samples_leaf': 5, 'l2_regularization': 6.25216928335074e-05, 'early_stopping': False, 'validation_fraction': 0.16114613730838845, 'n_estimators': 864}
[countdown] elapsed 00:18 | remaining budget ~ 00:00
[done] seed=0 R=3 | best_cv=0.79060 evals=192 | test_acc=0.69231 | run_time=18.1s
[ETA] finished 11/40 | est remaining ~ 08:44

--- Run 12/40 | n=50 | seed=1 | R=3 ---
[    random] DONE  t=18.0s  evals=194  best_cv=0.80983  params={'max_depth': 5, 'max_leaf_nodes': 171, 'learning_rate': 0.0016715449935425918, 'max_bins': 156, 'min_samples_leaf': 6, 'l2_regularization': 1.750035156118132e-05, 'early_stopping': False, 'validation_fraction': 0.17522490488930664, 'n_estimators': 764}
[countdown] elapsed 00:18 | remaining budget ~ 00:00
[done] seed=1 R=3 | best_cv=0.80983 evals=194 | test_acc=0.84615 | run_time=18.1s
[ETA] finished 12/40 | est remaining ~ 08:26

--- Run 13/40 | n=50 | seed=2 | R=3 ---
[    random] DONE  t=18.0s  evals=188  best_cv=0.77422  params={'max_depth': 12, 'max_leaf_nodes': 191, 'learning_rate': 0.029805150275766124, 'max_bins': 58, 'min_samples_leaf': 6, 'l2_regularization': 3.459112186373215e-06, 'early_stopping': True, 'validation_fraction': 0.2301821897363011, 'n_estimators': 967}
[countdown] elapsed 00:18 | remaining budget ~ 00:00
[done] seed=2 R=3 | best_cv=0.77422 evals=188 | test_acc=0.76923 | run_time=18.0s
[ETA] finished 13/40 | est remaining ~ 08:08

--- Run 14/40 | n=50 | seed=3 | R=3 ---
[    random] DONE  t=18.1s  evals=174  best_cv=0.87536  params={'max_depth': 7, 'max_leaf_nodes': 148, 'learning_rate': 0.005721143543817202, 'max_bins': 118, 'min_samples_leaf': 7, 'l2_regularization': 0.33019862559534535, 'early_stopping': False, 'validation_fraction': 0.05501322257614984, 'n_estimators': 730}
[countdown] elapsed 00:18 | remaining budget ~ 00:00
[done] seed=3 R=3 | best_cv=0.87536 evals=174 | test_acc=0.69231 | run_time=18.2s
[ETA] finished 14/40 | est remaining ~ 07:50

--- Run 15/40 | n=50 | seed=4 | R=3 ---
[    random] DONE  t=18.0s  evals=198  best_cv=0.75641  params={'max_depth': 6, 'max_leaf_nodes': 92, 'learning_rate': 0.0018109859691618404, 'max_bins': 133, 'min_samples_leaf': 127, 'l2_regularization': 1.2156425576670132e-05, 'early_stopping': True, 'validation_fraction': 0.054954294118268424, 'n_estimators': 662}
[countdown] elapsed 00:18 | remaining budget ~ 00:00
[done] seed=4 R=3 | best_cv=0.75641 evals=198 | test_acc=0.76923 | run_time=18.0s
[ETA] finished 15/40 | est remaining ~ 07:32

--- Run 16/40 | n=50 | seed=5 | R=3 ---
[    random] DONE  t=18.0s  evals=202  best_cv=0.80057  params={'max_depth': 7, 'max_leaf_nodes': 102, 'learning_rate': 0.042094986371793194, 'max_bins': 180, 'min_samples_leaf': 7, 'l2_regularization': 0.002089906802932934, 'early_stopping': False, 'validation_fraction': 0.13147623328798064, 'n_estimators': 380}
[countdown] elapsed 00:18 | remaining budget ~ 00:00
[done] seed=5 R=3 | best_cv=0.80057 evals=202 | test_acc=0.76923 | run_time=18.1s
[ETA] finished 16/40 | est remaining ~ 07:14

--- Run 17/40 | n=50 | seed=6 | R=3 ---
[    random] DONE  t=18.0s  evals=192  best_cv=0.75641  params={'max_depth': 12, 'max_leaf_nodes': 225, 'learning_rate': 0.0015900983178871216, 'max_bins': 227, 'min_samples_leaf': 71, 'l2_regularization': 1.8103360759547454e-06, 'early_stopping': True, 'validation_fraction': 0.21570464072094192, 'n_estimators': 581}
[countdown] elapsed 00:18 | remaining budget ~ 00:00
[done] seed=6 R=3 | best_cv=0.75641 evals=192 | test_acc=0.76923 | run_time=18.0s
[ETA] finished 17/40 | est remaining ~ 06:55

--- Run 18/40 | n=50 | seed=7 | R=3 ---
[    random] DONE  t=18.3s  evals=203  best_cv=0.85613  params={'max_depth': 12, 'max_leaf_nodes': 241, 'learning_rate': 0.007815455419965362, 'max_bins': 138, 'min_samples_leaf': 9, 'l2_regularization': 1.1213072207643184, 'early_stopping': False, 'validation_fraction': 0.21111955269649918, 'n_estimators': 500}
[countdown] elapsed 00:18 | remaining budget ~ 00:00
[done] seed=7 R=3 | best_cv=0.85613 evals=203 | test_acc=0.76923 | run_time=18.4s
[ETA] finished 18/40 | est remaining ~ 06:38

--- Run 19/40 | n=50 | seed=8 | R=3 ---
[    random] DONE  t=18.1s  evals=200  best_cv=0.75641  params={'max_depth': 6, 'max_leaf_nodes': 109, 'learning_rate': 0.25452918657433315, 'max_bins': 64, 'min_samples_leaf': 54, 'l2_regularization': 0.08584568296385033, 'early_stopping': True, 'validation_fraction': 0.08421075315669362, 'n_estimators': 930}
[countdown] elapsed 00:18 | remaining budget ~ 00:00
[done] seed=8 R=3 | best_cv=0.75641 evals=200 | test_acc=0.76923 | run_time=18.1s
[ETA] finished 19/40 | est remaining ~ 06:20

--- Run 20/40 | n=50 | seed=9 | R=3 ---
[    random] DONE  t=18.0s  evals=201  best_cv=0.83262  params={'max_depth': 5, 'max_leaf_nodes': 105, 'learning_rate': 0.09241059986824593, 'max_bins': 135, 'min_samples_leaf': 6, 'l2_regularization': 1.3678177539188232, 'early_stopping': False, 'validation_fraction': 0.29188460010875944, 'n_estimators': 196}
[countdown] elapsed 00:18 | remaining budget ~ 00:00
[done] seed=9 R=3 | best_cv=0.83262 evals=201 | test_acc=0.76923 | run_time=18.1s
[ETA] finished 20/40 | est remaining ~ 06:01

[aggregate]
R=3 | test_acc mean=0.76154 std=0.04367 sem=0.01381

==============================
Repetitions R = 5
==============================

--- Run 21/40 | n=50 | seed=0 | R=5 ---
[    random] DONE  t=18.1s  evals=119  best_cv=0.77094  params={'max_depth': 4, 'max_leaf_nodes': 84, 'learning_rate': 0.16191796869827138, 'max_bins': 42, 'min_samples_leaf': 5, 'l2_regularization': 6.25216928335074e-05, 'early_stopping': False, 'validation_fraction': 0.16114613730838845, 'n_estimators': 864}
[countdown] elapsed 00:18 | remaining budget ~ 00:00
[done] seed=0 R=5 | best_cv=0.77094 evals=119 | test_acc=0.69231 | run_time=18.2s
[ETA] finished 21/40 | est remaining ~ 05:43

--- Run 22/40 | n=50 | seed=1 | R=5 ---
[    random] DONE  t=18.3s  evals=114  best_cv=0.81026  params={'max_depth': 4, 'max_leaf_nodes': 36, 'learning_rate': 0.14797734328448847, 'max_bins': 147, 'min_samples_leaf': 8, 'l2_regularization': 0.19011526799871842, 'early_stopping': False, 'validation_fraction': 0.1123898064133557, 'n_estimators': 212}
[countdown] elapsed 00:18 | remaining budget ~ 00:00
[done] seed=1 R=5 | best_cv=0.81026 evals=114 | test_acc=0.84615 | run_time=18.3s
[ETA] finished 22/40 | est remaining ~ 05:25

--- Run 23/40 | n=50 | seed=2 | R=5 ---
[    random] DONE  t=18.0s  evals=108  best_cv=0.75641  params={'max_depth': 3, 'max_leaf_nodes': 38, 'learning_rate': 0.0016299714138735375, 'max_bins': 245, 'min_samples_leaf': 48, 'l2_regularization': 0.14183712625044814, 'early_stopping': False, 'validation_fraction': 0.11289582439874142, 'n_estimators': 317}
[countdown] elapsed 00:18 | remaining budget ~ 00:00
[done] seed=2 R=5 | best_cv=0.75641 evals=108 | test_acc=0.76923 | run_time=18.1s
[ETA] finished 23/40 | est remaining ~ 05:07

--- Run 24/40 | n=50 | seed=3 | R=5 ---
[    random] DONE  t=18.1s  evals=106  best_cv=0.86068  params={'max_depth': 7, 'max_leaf_nodes': 148, 'learning_rate': 0.005721143543817202, 'max_bins': 118, 'min_samples_leaf': 7, 'l2_regularization': 0.33019862559534535, 'early_stopping': False, 'validation_fraction': 0.05501322257614984, 'n_estimators': 730}
[countdown] elapsed 00:18 | remaining budget ~ 00:00
[done] seed=3 R=5 | best_cv=0.86068 evals=106 | test_acc=0.69231 | run_time=18.2s
[ETA] finished 24/40 | est remaining ~ 04:49

--- Run 25/40 | n=50 | seed=4 | R=5 ---
[    random] DONE  t=18.3s  evals=122  best_cv=0.75641  params={'max_depth': 6, 'max_leaf_nodes': 92, 'learning_rate': 0.0018109859691618404, 'max_bins': 133, 'min_samples_leaf': 127, 'l2_regularization': 1.2156425576670132e-05, 'early_stopping': True, 'validation_fraction': 0.054954294118268424, 'n_estimators': 662}
[countdown] elapsed 00:18 | remaining budget ~ 00:00
[done] seed=4 R=5 | best_cv=0.75641 evals=122 | test_acc=0.76923 | run_time=18.3s
[ETA] finished 25/40 | est remaining ~ 04:31

--- Run 26/40 | n=50 | seed=5 | R=5 ---
[    random] DONE  t=18.3s  evals=123  best_cv=0.81538  params={'max_depth': 9, 'max_leaf_nodes': 148, 'learning_rate': 0.03653828687844435, 'max_bins': 217, 'min_samples_leaf': 8, 'l2_regularization': 2.460315334897857, 'early_stopping': False, 'validation_fraction': 0.22215132238164909, 'n_estimators': 946}
[countdown] elapsed 00:18 | remaining budget ~ 00:00
[done] seed=5 R=5 | best_cv=0.81538 evals=123 | test_acc=0.76923 | run_time=18.4s
[ETA] finished 26/40 | est remaining ~ 04:13

--- Run 27/40 | n=50 | seed=6 | R=5 ---
[    random] DONE  t=18.2s  evals=118  best_cv=0.75641  params={'max_depth': 12, 'max_leaf_nodes': 225, 'learning_rate': 0.0015900983178871216, 'max_bins': 227, 'min_samples_leaf': 71, 'l2_regularization': 1.8103360759547454e-06, 'early_stopping': True, 'validation_fraction': 0.21570464072094192, 'n_estimators': 581}
[countdown] elapsed 00:18 | remaining budget ~ 00:00
[done] seed=6 R=5 | best_cv=0.75641 evals=118 | test_acc=0.76923 | run_time=18.2s
[ETA] finished 27/40 | est remaining ~ 03:55

--- Run 28/40 | n=50 | seed=7 | R=5 ---
[    random] DONE  t=18.0s  evals=114  best_cv=0.83248  params={'max_depth': 10, 'max_leaf_nodes': 244, 'learning_rate': 0.15501120092754306, 'max_bins': 132, 'min_samples_leaf': 11, 'l2_regularization': 1.2985446363624275e-05, 'early_stopping': False, 'validation_fraction': 0.2203970291665947, 'n_estimators': 515}
[countdown] elapsed 00:18 | remaining budget ~ 00:00
[done] seed=7 R=5 | best_cv=0.83248 evals=114 | test_acc=0.53846 | run_time=18.1s
[ETA] finished 28/40 | est remaining ~ 03:37

--- Run 29/40 | n=50 | seed=8 | R=5 ---
[    random] DONE  t=18.0s  evals=122  best_cv=0.75641  params={'max_depth': 6, 'max_leaf_nodes': 109, 'learning_rate': 0.25452918657433315, 'max_bins': 64, 'min_samples_leaf': 54, 'l2_regularization': 0.08584568296385033, 'early_stopping': True, 'validation_fraction': 0.08421075315669362, 'n_estimators': 930}
[countdown] elapsed 00:18 | remaining budget ~ 00:00
[done] seed=8 R=5 | best_cv=0.75641 evals=122 | test_acc=0.76923 | run_time=18.1s
[ETA] finished 29/40 | est remaining ~ 03:19

--- Run 30/40 | n=50 | seed=9 | R=5 ---
[    random] DONE  t=18.0s  evals=132  best_cv=0.85641  params={'max_depth': 5, 'max_leaf_nodes': 105, 'learning_rate': 0.09241059986824593, 'max_bins': 135, 'min_samples_leaf': 6, 'l2_regularization': 1.3678177539188232, 'early_stopping': False, 'validation_fraction': 0.29188460010875944, 'n_estimators': 196}
[countdown] elapsed 00:18 | remaining budget ~ 00:00
[done] seed=9 R=5 | best_cv=0.85641 evals=132 | test_acc=0.76923 | run_time=18.1s
[ETA] finished 30/40 | est remaining ~ 03:01

[aggregate]
R=5 | test_acc mean=0.73846 std=0.08269 sem=0.02615

==============================
Repetitions R = 10
==============================

--- Run 31/40 | n=50 | seed=0 | R=10 ---
[    random] DONE  t=18.2s  evals=55  best_cv=0.75641  params={'max_depth': 9, 'max_leaf_nodes': 209, 'learning_rate': 0.16811629181527474, 'max_bins': 42, 'min_samples_leaf': 71, 'l2_regularization': 5.731314024358108, 'early_stopping': False, 'validation_fraction': 0.15123353436260356, 'n_estimators': 902}
[countdown] elapsed 00:18 | remaining budget ~ 00:00
[done] seed=0 R=10 | best_cv=0.75641 evals=55 | test_acc=0.76923 | run_time=18.3s
[ETA] finished 31/40 | est remaining ~ 02:43

--- Run 32/40 | n=50 | seed=1 | R=10 ---
[    random] DONE  t=18.5s  evals=59  best_cv=0.79893  params={'max_depth': 4, 'max_leaf_nodes': 36, 'learning_rate': 0.14797734328448847, 'max_bins': 147, 'min_samples_leaf': 8, 'l2_regularization': 0.19011526799871842, 'early_stopping': False, 'validation_fraction': 0.1123898064133557, 'n_estimators': 212}
[countdown] elapsed 00:18 | remaining budget ~ 00:00
[done] seed=1 R=10 | best_cv=0.79893 evals=59 | test_acc=0.84615 | run_time=18.6s
[ETA] finished 32/40 | est remaining ~ 02:25

--- Run 33/40 | n=50 | seed=2 | R=10 ---
[    random] DONE  t=18.1s  evals=53  best_cv=0.75641  params={'max_depth': 3, 'max_leaf_nodes': 38, 'learning_rate': 0.0016299714138735375, 'max_bins': 245, 'min_samples_leaf': 48, 'l2_regularization': 0.14183712625044814, 'early_stopping': False, 'validation_fraction': 0.11289582439874142, 'n_estimators': 317}
[countdown] elapsed 00:18 | remaining budget ~ 00:00
[done] seed=2 R=10 | best_cv=0.75641 evals=53 | test_acc=0.76923 | run_time=18.1s
[ETA] finished 33/40 | est remaining ~ 02:07

--- Run 34/40 | n=50 | seed=3 | R=10 ---
[    random] DONE  t=18.7s  evals=51  best_cv=0.85983  params={'max_depth': 7, 'max_leaf_nodes': 148, 'learning_rate': 0.005721143543817202, 'max_bins': 118, 'min_samples_leaf': 7, 'l2_regularization': 0.33019862559534535, 'early_stopping': False, 'validation_fraction': 0.05501322257614984, 'n_estimators': 730}
[countdown] elapsed 00:18 | remaining budget ~ 00:00
[done] seed=3 R=10 | best_cv=0.85983 evals=51 | test_acc=0.69231 | run_time=18.8s
[ETA] finished 34/40 | est remaining ~ 01:49

--- Run 35/40 | n=50 | seed=4 | R=10 ---
[    random] DONE  t=18.1s  evals=51  best_cv=0.75641  params={'max_depth': 6, 'max_leaf_nodes': 92, 'learning_rate': 0.0018109859691618404, 'max_bins': 133, 'min_samples_leaf': 127, 'l2_regularization': 1.2156425576670132e-05, 'early_stopping': True, 'validation_fraction': 0.054954294118268424, 'n_estimators': 662}
[countdown] elapsed 00:18 | remaining budget ~ 00:00
[done] seed=4 R=10 | best_cv=0.75641 evals=51 | test_acc=0.76923 | run_time=18.1s
[ETA] finished 35/40 | est remaining ~ 01:30

--- Run 36/40 | n=50 | seed=5 | R=10 ---
[    random] DONE  t=18.1s  evals=53  best_cv=0.79594  params={'max_depth': 7, 'max_leaf_nodes': 102, 'learning_rate': 0.042094986371793194, 'max_bins': 180, 'min_samples_leaf': 7, 'l2_regularization': 0.002089906802932934, 'early_stopping': False, 'validation_fraction': 0.13147623328798064, 'n_estimators': 380}
[countdown] elapsed 00:18 | remaining budget ~ 00:00
[done] seed=5 R=10 | best_cv=0.79594 evals=53 | test_acc=0.76923 | run_time=18.1s
[ETA] finished 36/40 | est remaining ~ 01:12

--- Run 37/40 | n=50 | seed=6 | R=10 ---
[    random] DONE  t=18.4s  evals=62  best_cv=0.75641  params={'max_depth': 12, 'max_leaf_nodes': 225, 'learning_rate': 0.0015900983178871216, 'max_bins': 227, 'min_samples_leaf': 71, 'l2_regularization': 1.8103360759547454e-06, 'early_stopping': True, 'validation_fraction': 0.21570464072094192, 'n_estimators': 581}
[countdown] elapsed 00:18 | remaining budget ~ 00:00
[done] seed=6 R=10 | best_cv=0.75641 evals=62 | test_acc=0.76923 | run_time=18.4s
[ETA] finished 37/40 | est remaining ~ 00:54

--- Run 38/40 | n=50 | seed=7 | R=10 ---
[    random] DONE  t=18.4s  evals=60  best_cv=0.81368  params={'max_depth': 11, 'max_leaf_nodes': 107, 'learning_rate': 0.0023254464722065916, 'max_bins': 171, 'min_samples_leaf': 11, 'l2_regularization': 0.20276860659740087, 'early_stopping': False, 'validation_fraction': 0.2946253106797432, 'n_estimators': 984}
[countdown] elapsed 00:18 | remaining budget ~ 00:00
[done] seed=7 R=10 | best_cv=0.81368 evals=60 | test_acc=0.61538 | run_time=18.5s
[ETA] finished 38/40 | est remaining ~ 00:36

--- Run 39/40 | n=50 | seed=8 | R=10 ---
[    random] DONE  t=18.2s  evals=61  best_cv=0.75641  params={'max_depth': 6, 'max_leaf_nodes': 109, 'learning_rate': 0.25452918657433315, 'max_bins': 64, 'min_samples_leaf': 54, 'l2_regularization': 0.08584568296385033, 'early_stopping': True, 'validation_fraction': 0.08421075315669362, 'n_estimators': 930}
[countdown] elapsed 00:18 | remaining budget ~ 00:00
[done] seed=8 R=10 | best_cv=0.75641 evals=61 | test_acc=0.76923 | run_time=18.2s
[ETA] finished 39/40 | est remaining ~ 00:18

--- Run 40/40 | n=50 | seed=9 | R=10 ---
[    random] DONE  t=18.4s  evals=64  best_cv=0.84124  params={'max_depth': 5, 'max_leaf_nodes': 105, 'learning_rate': 0.09241059986824593, 'max_bins': 135, 'min_samples_leaf': 6, 'l2_regularization': 1.3678177539188232, 'early_stopping': False, 'validation_fraction': 0.29188460010875944, 'n_estimators': 196}
[countdown] elapsed 00:18 | remaining budget ~ 00:00
[done] seed=9 R=10 | best_cv=0.84124 evals=64 | test_acc=0.76923 | run_time=18.4s
[ETA] finished 40/40 | est remaining ~ 00:00

[aggregate]
R=10 | test_acc mean=0.75385 std=0.06068 sem=0.01919

==============================
FINAL SUMMARY (TEST performance after HPO)
==============================
   R      mean       std       sem  outer_seeds
-----------------------------------------------
   1   0.73077   0.07476   0.02364           10
   5   0.73846   0.08269   0.02615           10
  10   0.75385   0.06068   0.01919           10

Wrote results to: __experi_21283079_output/n50_repeatedcv_results.csv
Thu Dec 18 12:03:24 PM EST 2025
Job 21283079 finished.
