/blue/ruogu.fang/junfu.cheng/.conda/envs/ml_exp_torch/lib/python3.14/site-packages/torch/utils/data/dataloader.py:668: UserWarning: 'pin_memory' argument is set as true but no accelerator is found, then device pinned memory won't be used.
  warnings.warn(warn_msg)
[      grid] t=  13s  evals=    4  best_val=0.84730  params={'batch_size': 64, 'lr': 0.0001, 'weight_decay': 0.0, 'optimizer': 'adam', 'momentum': 0.0, 'h1': 128, 'h2': 128, 'dropout': 0.0, 'max_epochs': 10, 'patience': 2}
[      grid] t=  27s  evals=    6  best_val=0.85638  params={'batch_size': 64, 'lr': 0.0001, 'weight_decay': 0.0, 'optimizer': 'adam', 'momentum': 0.0, 'h1': 128, 'h2': 128, 'dropout': 0.0, 'max_epochs': 15, 'patience': 2}
[      grid] t=  38s  evals=    8  best_val=0.85638  params={'batch_size': 64, 'lr': 0.0001, 'weight_decay': 0.0, 'optimizer': 'adam', 'momentum': 0.0, 'h1': 128, 'h2': 128, 'dropout': 0.0, 'max_epochs': 15, 'patience': 2}
[      grid] t=  52s  evals=   11  best_val=0.85638  params={'batch_size': 64, 'lr': 0.0001, 'weight_decay': 0.0, 'optimizer': 'adam', 'momentum': 0.0, 'h1': 128, 'h2': 128, 'dropout': 0.0, 'max_epochs': 15, 'patience': 2}
[      grid] t=  69s  evals=   13  best_val=0.85638  params={'batch_size': 64, 'lr': 0.0001, 'weight_decay': 0.0, 'optimizer': 'adam', 'momentum': 0.0, 'h1': 128, 'h2': 128, 'dropout': 0.0, 'max_epochs': 15, 'patience': 2}
[      grid] t=  80s  evals=   16  best_val=0.85638  params={'batch_size': 64, 'lr': 0.0001, 'weight_decay': 0.0, 'optimizer': 'adam', 'momentum': 0.0, 'h1': 128, 'h2': 128, 'dropout': 0.0, 'max_epochs': 15, 'patience': 2}
[      grid] t=  95s  evals=   18  best_val=0.85638  params={'batch_size': 64, 'lr': 0.0001, 'weight_decay': 0.0, 'optimizer': 'adam', 'momentum': 0.0, 'h1': 128, 'h2': 128, 'dropout': 0.0, 'max_epochs': 15, 'patience': 2}
[      grid] t= 106s  evals=   20  best_val=0.85638  params={'batch_size': 64, 'lr': 0.0001, 'weight_decay': 0.0, 'optimizer': 'adam', 'momentum': 0.0, 'h1': 128, 'h2': 128, 'dropout': 0.0, 'max_epochs': 15, 'patience': 2}
[      grid] t= 120s  evals=   23  best_val=0.85638  params={'batch_size': 64, 'lr': 0.0001, 'weight_decay': 0.0, 'optimizer': 'adam', 'momentum': 0.0, 'h1': 128, 'h2': 128, 'dropout': 0.0, 'max_epochs': 15, 'patience': 2}
[      grid] t= 135s  evals=   25  best_val=0.85871  params={'batch_size': 64, 'lr': 0.0001, 'weight_decay': 0.0, 'optimizer': 'adam', 'momentum': 0.0, 'h1': 128, 'h2': 256, 'dropout': 0.0, 'max_epochs': 15, 'patience': 4}
[      grid] t= 147s  evals=   28  best_val=0.85871  params={'batch_size': 64, 'lr': 0.0001, 'weight_decay': 0.0, 'optimizer': 'adam', 'momentum': 0.0, 'h1': 128, 'h2': 256, 'dropout': 0.0, 'max_epochs': 15, 'patience': 4}
[      grid] t= 162s  evals=   30  best_val=0.85871  params={'batch_size': 64, 'lr': 0.0001, 'weight_decay': 0.0, 'optimizer': 'adam', 'momentum': 0.0, 'h1': 128, 'h2': 256, 'dropout': 0.0, 'max_epochs': 15, 'patience': 4}
[      grid] t= 174s  evals=   32  best_val=0.85871  params={'batch_size': 64, 'lr': 0.0001, 'weight_decay': 0.0, 'optimizer': 'adam', 'momentum': 0.0, 'h1': 128, 'h2': 256, 'dropout': 0.0, 'max_epochs': 15, 'patience': 4}
[      grid] t= 190s  evals=   35  best_val=0.85871  params={'batch_size': 64, 'lr': 0.0001, 'weight_decay': 0.0, 'optimizer': 'adam', 'momentum': 0.0, 'h1': 128, 'h2': 256, 'dropout': 0.0, 'max_epochs': 15, 'patience': 4}
[      grid] t= 208s  evals=   37  best_val=0.85871  params={'batch_size': 64, 'lr': 0.0001, 'weight_decay': 0.0, 'optimizer': 'adam', 'momentum': 0.0, 'h1': 128, 'h2': 256, 'dropout': 0.0, 'max_epochs': 15, 'patience': 4}
[      grid] t= 220s  evals=   40  best_val=0.85871  params={'batch_size': 64, 'lr': 0.0001, 'weight_decay': 0.0, 'optimizer': 'adam', 'momentum': 0.0, 'h1': 128, 'h2': 256, 'dropout': 0.0, 'max_epochs': 15, 'patience': 4}
[      grid] t= 235s  evals=   42  best_val=0.86270  params={'batch_size': 64, 'lr': 0.0001, 'weight_decay': 0.0, 'optimizer': 'adam', 'momentum': 0.0, 'h1': 128, 'h2': 512, 'dropout': 0.0, 'max_epochs': 15, 'patience': 2}
[      grid] t= 247s  evals=   44  best_val=0.86270  params={'batch_size': 64, 'lr': 0.0001, 'weight_decay': 0.0, 'optimizer': 'adam', 'momentum': 0.0, 'h1': 128, 'h2': 512, 'dropout': 0.0, 'max_epochs': 15, 'patience': 2}
[      grid] t= 263s  evals=   47  best_val=0.86270  params={'batch_size': 64, 'lr': 0.0001, 'weight_decay': 0.0, 'optimizer': 'adam', 'momentum': 0.0, 'h1': 128, 'h2': 512, 'dropout': 0.0, 'max_epochs': 15, 'patience': 2}
[      grid] t= 283s  evals=   49  best_val=0.86270  params={'batch_size': 64, 'lr': 0.0001, 'weight_decay': 0.0, 'optimizer': 'adam', 'momentum': 0.0, 'h1': 128, 'h2': 512, 'dropout': 0.0, 'max_epochs': 15, 'patience': 2}
[      grid] t= 297s  evals=   52  best_val=0.86270  params={'batch_size': 64, 'lr': 0.0001, 'weight_decay': 0.0, 'optimizer': 'adam', 'momentum': 0.0, 'h1': 128, 'h2': 512, 'dropout': 0.0, 'max_epochs': 15, 'patience': 2}
[      grid] t= 314s  evals=   54  best_val=0.86270  params={'batch_size': 64, 'lr': 0.0001, 'weight_decay': 0.0, 'optimizer': 'adam', 'momentum': 0.0, 'h1': 128, 'h2': 512, 'dropout': 0.0, 'max_epochs': 15, 'patience': 2}
[      grid] t= 325s  evals=   55  best_val=0.86270  params={'batch_size': 64, 'lr': 0.0001, 'weight_decay': 0.0, 'optimizer': 'adam', 'momentum': 0.0, 'h1': 128, 'h2': 512, 'dropout': 0.0, 'max_epochs': 15, 'patience': 2}
[      grid] t= 337s  evals=   58  best_val=0.86270  params={'batch_size': 64, 'lr': 0.0001, 'weight_decay': 0.0, 'optimizer': 'adam', 'momentum': 0.0, 'h1': 128, 'h2': 512, 'dropout': 0.0, 'max_epochs': 15, 'patience': 2}
[      grid] t= 353s  evals=   60  best_val=0.86571  params={'batch_size': 64, 'lr': 0.0001, 'weight_decay': 0.0, 'optimizer': 'adam', 'momentum': 0.0, 'h1': 256, 'h2': 128, 'dropout': 0.0, 'max_epochs': 15, 'patience': 2}
[      grid] t= 366s  evals=   62  best_val=0.86571  params={'batch_size': 64, 'lr': 0.0001, 'weight_decay': 0.0, 'optimizer': 'adam', 'momentum': 0.0, 'h1': 256, 'h2': 128, 'dropout': 0.0, 'max_epochs': 15, 'patience': 2}
[      grid] t= 376s  evals=   64  best_val=0.86571  params={'batch_size': 64, 'lr': 0.0001, 'weight_decay': 0.0, 'optimizer': 'adam', 'momentum': 0.0, 'h1': 256, 'h2': 128, 'dropout': 0.0, 'max_epochs': 15, 'patience': 2}
[      grid] t= 393s  evals=   66  best_val=0.86571  params={'batch_size': 64, 'lr': 0.0001, 'weight_decay': 0.0, 'optimizer': 'adam', 'momentum': 0.0, 'h1': 256, 'h2': 128, 'dropout': 0.0, 'max_epochs': 15, 'patience': 2}
[      grid] t= 403s  evals=   67  best_val=0.86571  params={'batch_size': 64, 'lr': 0.0001, 'weight_decay': 0.0, 'optimizer': 'adam', 'momentum': 0.0, 'h1': 256, 'h2': 128, 'dropout': 0.0, 'max_epochs': 15, 'patience': 2}
[      grid] t= 417s  evals=   70  best_val=0.86571  params={'batch_size': 64, 'lr': 0.0001, 'weight_decay': 0.0, 'optimizer': 'adam', 'momentum': 0.0, 'h1': 256, 'h2': 128, 'dropout': 0.0, 'max_epochs': 15, 'patience': 2}
[      grid] t= 433s  evals=   72  best_val=0.86571  params={'batch_size': 64, 'lr': 0.0001, 'weight_decay': 0.0, 'optimizer': 'adam', 'momentum': 0.0, 'h1': 256, 'h2': 128, 'dropout': 0.0, 'max_epochs': 15, 'patience': 2}
[      grid] t= 443s  evals=   73  best_val=0.86571  params={'batch_size': 64, 'lr': 0.0001, 'weight_decay': 0.0, 'optimizer': 'adam', 'momentum': 0.0, 'h1': 256, 'h2': 128, 'dropout': 0.0, 'max_epochs': 15, 'patience': 2}
[      grid] t= 457s  evals=   76  best_val=0.86571  params={'batch_size': 64, 'lr': 0.0001, 'weight_decay': 0.0, 'optimizer': 'adam', 'momentum': 0.0, 'h1': 256, 'h2': 128, 'dropout': 0.0, 'max_epochs': 15, 'patience': 2}
[      grid] t= 471s  evals=   78  best_val=0.86576  params={'batch_size': 64, 'lr': 0.0001, 'weight_decay': 0.0, 'optimizer': 'adam', 'momentum': 0.0, 'h1': 256, 'h2': 256, 'dropout': 0.0, 'max_epochs': 15, 'patience': 4}
[      grid] t= 484s  evals=   80  best_val=0.86576  params={'batch_size': 64, 'lr': 0.0001, 'weight_decay': 0.0, 'optimizer': 'adam', 'momentum': 0.0, 'h1': 256, 'h2': 256, 'dropout': 0.0, 'max_epochs': 15, 'patience': 4}
[      grid] t= 495s  evals=   82  best_val=0.86576  params={'batch_size': 64, 'lr': 0.0001, 'weight_decay': 0.0, 'optimizer': 'adam', 'momentum': 0.0, 'h1': 256, 'h2': 256, 'dropout': 0.0, 'max_epochs': 15, 'patience': 4}
[      grid] t= 513s  evals=   84  best_val=0.86576  params={'batch_size': 64, 'lr': 0.0001, 'weight_decay': 0.0, 'optimizer': 'adam', 'momentum': 0.0, 'h1': 256, 'h2': 256, 'dropout': 0.0, 'max_epochs': 15, 'patience': 4}
[      grid] t= 524s  evals=   85  best_val=0.86576  params={'batch_size': 64, 'lr': 0.0001, 'weight_decay': 0.0, 'optimizer': 'adam', 'momentum': 0.0, 'h1': 256, 'h2': 256, 'dropout': 0.0, 'max_epochs': 15, 'patience': 4}
[      grid] t= 539s  evals=   88  best_val=0.86576  params={'batch_size': 64, 'lr': 0.0001, 'weight_decay': 0.0, 'optimizer': 'adam', 'momentum': 0.0, 'h1': 256, 'h2': 256, 'dropout': 0.0, 'max_epochs': 15, 'patience': 4}
[      grid] t= 558s  evals=   90  best_val=0.86576  params={'batch_size': 64, 'lr': 0.0001, 'weight_decay': 0.0, 'optimizer': 'adam', 'momentum': 0.0, 'h1': 256, 'h2': 256, 'dropout': 0.0, 'max_epochs': 15, 'patience': 4}
[      grid] t= 569s  evals=   91  best_val=0.86576  params={'batch_size': 64, 'lr': 0.0001, 'weight_decay': 0.0, 'optimizer': 'adam', 'momentum': 0.0, 'h1': 256, 'h2': 256, 'dropout': 0.0, 'max_epochs': 15, 'patience': 4}
[      grid] t= 584s  evals=   94  best_val=0.86576  params={'batch_size': 64, 'lr': 0.0001, 'weight_decay': 0.0, 'optimizer': 'adam', 'momentum': 0.0, 'h1': 256, 'h2': 256, 'dropout': 0.0, 'max_epochs': 15, 'patience': 4}
[      grid] t= 600s  evals=   96  best_val=0.87059  params={'batch_size': 64, 'lr': 0.0001, 'weight_decay': 0.0, 'optimizer': 'adam', 'momentum': 0.0, 'h1': 256, 'h2': 512, 'dropout': 0.0, 'max_epochs': 15, 'patience': 4}
[      grid] t= 611s  evals=   97  best_val=0.87059  params={'batch_size': 64, 'lr': 0.0001, 'weight_decay': 0.0, 'optimizer': 'adam', 'momentum': 0.0, 'h1': 256, 'h2': 512, 'dropout': 0.0, 'max_epochs': 15, 'patience': 4}
[      grid] t= 628s  evals=  100  best_val=0.87059  params={'batch_size': 64, 'lr': 0.0001, 'weight_decay': 0.0, 'optimizer': 'adam', 'momentum': 0.0, 'h1': 256, 'h2': 512, 'dropout': 0.0, 'max_epochs': 15, 'patience': 4}
[      grid] t= 649s  evals=  102  best_val=0.87059  params={'batch_size': 64, 'lr': 0.0001, 'weight_decay': 0.0, 'optimizer': 'adam', 'momentum': 0.0, 'h1': 256, 'h2': 512, 'dropout': 0.0, 'max_epochs': 15, 'patience': 4}
[      grid] t= 661s  evals=  103  best_val=0.87059  params={'batch_size': 64, 'lr': 0.0001, 'weight_decay': 0.0, 'optimizer': 'adam', 'momentum': 0.0, 'h1': 256, 'h2': 512, 'dropout': 0.0, 'max_epochs': 15, 'patience': 4}
[      grid] t= 678s  evals=  106  best_val=0.87059  params={'batch_size': 64, 'lr': 0.0001, 'weight_decay': 0.0, 'optimizer': 'adam', 'momentum': 0.0, 'h1': 256, 'h2': 512, 'dropout': 0.0, 'max_epochs': 15, 'patience': 4}
[      grid] t= 699s  evals=  108  best_val=0.87059  params={'batch_size': 64, 'lr': 0.0001, 'weight_decay': 0.0, 'optimizer': 'adam', 'momentum': 0.0, 'h1': 256, 'h2': 512, 'dropout': 0.0, 'max_epochs': 15, 'patience': 4}
[      grid] t= 712s  evals=  109  best_val=0.87059  params={'batch_size': 64, 'lr': 0.0001, 'weight_decay': 0.0, 'optimizer': 'adam', 'momentum': 0.0, 'h1': 256, 'h2': 512, 'dropout': 0.0, 'max_epochs': 15, 'patience': 4}
[      grid] t= 728s  evals=  112  best_val=0.87059  params={'batch_size': 64, 'lr': 0.0001, 'weight_decay': 0.0, 'optimizer': 'adam', 'momentum': 0.0, 'h1': 256, 'h2': 512, 'dropout': 0.0, 'max_epochs': 15, 'patience': 4}
[      grid] t= 749s  evals=  114  best_val=0.87059  params={'batch_size': 64, 'lr': 0.0001, 'weight_decay': 0.0, 'optimizer': 'adam', 'momentum': 0.0, 'h1': 256, 'h2': 512, 'dropout': 0.0, 'max_epochs': 15, 'patience': 4}
[      grid] t= 761s  evals=  115  best_val=0.87059  params={'batch_size': 64, 'lr': 0.0001, 'weight_decay': 0.0, 'optimizer': 'adam', 'momentum': 0.0, 'h1': 256, 'h2': 512, 'dropout': 0.0, 'max_epochs': 15, 'patience': 4}
[      grid] t= 779s  evals=  118  best_val=0.87059  params={'batch_size': 64, 'lr': 0.0001, 'weight_decay': 0.0, 'optimizer': 'adam', 'momentum': 0.0, 'h1': 256, 'h2': 512, 'dropout': 0.0, 'max_epochs': 15, 'patience': 4}
[      grid] t= 801s  evals=  120  best_val=0.87059  params={'batch_size': 64, 'lr': 0.0001, 'weight_decay': 0.0, 'optimizer': 'adam', 'momentum': 0.0, 'h1': 256, 'h2': 512, 'dropout': 0.0, 'max_epochs': 15, 'patience': 4}
[      grid] t= 815s  evals=  121  best_val=0.87059  params={'batch_size': 64, 'lr': 0.0001, 'weight_decay': 0.0, 'optimizer': 'adam', 'momentum': 0.0, 'h1': 256, 'h2': 512, 'dropout': 0.0, 'max_epochs': 15, 'patience': 4}
[      grid] t= 833s  evals=  124  best_val=0.87059  params={'batch_size': 64, 'lr': 0.0001, 'weight_decay': 0.0, 'optimizer': 'adam', 'momentum': 0.0, 'h1': 256, 'h2': 512, 'dropout': 0.0, 'max_epochs': 15, 'patience': 4}
[      grid] t= 856s  evals=  126  best_val=0.87059  params={'batch_size': 64, 'lr': 0.0001, 'weight_decay': 0.0, 'optimizer': 'adam', 'momentum': 0.0, 'h1': 256, 'h2': 512, 'dropout': 0.0, 'max_epochs': 15, 'patience': 4}
[      grid] t= 870s  evals=  127  best_val=0.87059  params={'batch_size': 64, 'lr': 0.0001, 'weight_decay': 0.0, 'optimizer': 'adam', 'momentum': 0.0, 'h1': 256, 'h2': 512, 'dropout': 0.0, 'max_epochs': 15, 'patience': 4}
[      grid] t= 887s  evals=  130  best_val=0.87059  params={'batch_size': 64, 'lr': 0.0001, 'weight_decay': 0.0, 'optimizer': 'adam', 'momentum': 0.0, 'h1': 256, 'h2': 512, 'dropout': 0.0, 'max_epochs': 15, 'patience': 4}
[      grid] DONE  t=905.3s  evals=131  best_val=0.87059  params={'batch_size': 64, 'lr': 0.0001, 'weight_decay': 0.0, 'optimizer': 'adam', 'momentum': 0.0, 'h1': 256, 'h2': 512, 'dropout': 0.0, 'max_epochs': 15, 'patience': 4}
[    random] t=  12s  evals=    3  best_val=0.81734  params={'batch_size': 128, 'lr': 0.005858643226824369, 'weight_decay': 0.0011146853244234747, 'optimizer': 'adam', 'momentum': 0.0, 'h1': 70, 'h2': 841, 'dropout': 0.4834915510996847, 'max_epochs': 16, 'patience': 3}
[    random] t=  32s  evals=    5  best_val=0.85461  params={'batch_size': 32, 'lr': 0.0154594970266976, 'weight_decay': 4.798886266377097e-05, 'optimizer': 'sgd', 'momentum': 0.9244599757804021, 'h1': 451, 'h2': 144, 'dropout': 0.3312243787639362, 'max_epochs': 14, 'patience': 5}
[    random] t=  82s  evals=    7  best_val=0.88223  params={'batch_size': 256, 'lr': 0.0001616834049132274, 'weight_decay': 0.00020244944608069254, 'optimizer': 'adam', 'momentum': 0.0, 'h1': 855, 'h2': 360, 'dropout': 0.5911329123964546, 'max_epochs': 10, 'patience': 1}
[    random] t=  93s  evals=    9  best_val=0.88223  params={'batch_size': 256, 'lr': 0.0001616834049132274, 'weight_decay': 0.00020244944608069254, 'optimizer': 'adam', 'momentum': 0.0, 'h1': 855, 'h2': 360, 'dropout': 0.5911329123964546, 'max_epochs': 10, 'patience': 1}
[    random] t= 119s  evals=   11  best_val=0.88223  params={'batch_size': 256, 'lr': 0.0001616834049132274, 'weight_decay': 0.00020244944608069254, 'optimizer': 'adam', 'momentum': 0.0, 'h1': 855, 'h2': 360, 'dropout': 0.5911329123964546, 'max_epochs': 10, 'patience': 1}
[    random] t= 171s  evals=   13  best_val=0.89900  params={'batch_size': 256, 'lr': 0.0003019576280099601, 'weight_decay': 0.00025258413428440015, 'optimizer': 'adam', 'momentum': 0.0, 'h1': 674, 'h2': 129, 'dropout': 0.23086038700470002, 'max_epochs': 17, 'patience': 5}
[    random] t= 218s  evals=   14  best_val=0.89900  params={'batch_size': 256, 'lr': 0.0003019576280099601, 'weight_decay': 0.00025258413428440015, 'optimizer': 'adam', 'momentum': 0.0, 'h1': 674, 'h2': 129, 'dropout': 0.23086038700470002, 'max_epochs': 17, 'patience': 5}
[    random] t= 246s  evals=   15  best_val=0.89900  params={'batch_size': 256, 'lr': 0.0003019576280099601, 'weight_decay': 0.00025258413428440015, 'optimizer': 'adam', 'momentum': 0.0, 'h1': 674, 'h2': 129, 'dropout': 0.23086038700470002, 'max_epochs': 17, 'patience': 5}
[    random] t= 269s  evals=   16  best_val=0.89900  params={'batch_size': 256, 'lr': 0.0003019576280099601, 'weight_decay': 0.00025258413428440015, 'optimizer': 'adam', 'momentum': 0.0, 'h1': 674, 'h2': 129, 'dropout': 0.23086038700470002, 'max_epochs': 17, 'patience': 5}
[    random] t= 311s  evals=   17  best_val=0.89900  params={'batch_size': 256, 'lr': 0.0003019576280099601, 'weight_decay': 0.00025258413428440015, 'optimizer': 'adam', 'momentum': 0.0, 'h1': 674, 'h2': 129, 'dropout': 0.23086038700470002, 'max_epochs': 17, 'patience': 5}
[    random] t= 339s  evals=   20  best_val=0.89900  params={'batch_size': 256, 'lr': 0.0003019576280099601, 'weight_decay': 0.00025258413428440015, 'optimizer': 'adam', 'momentum': 0.0, 'h1': 674, 'h2': 129, 'dropout': 0.23086038700470002, 'max_epochs': 17, 'patience': 5}
[    random] t= 367s  evals=   22  best_val=0.89900  params={'batch_size': 256, 'lr': 0.0003019576280099601, 'weight_decay': 0.00025258413428440015, 'optimizer': 'adam', 'momentum': 0.0, 'h1': 674, 'h2': 129, 'dropout': 0.23086038700470002, 'max_epochs': 17, 'patience': 5}
[    random] t= 377s  evals=   24  best_val=0.89900  params={'batch_size': 256, 'lr': 0.0003019576280099601, 'weight_decay': 0.00025258413428440015, 'optimizer': 'adam', 'momentum': 0.0, 'h1': 674, 'h2': 129, 'dropout': 0.23086038700470002, 'max_epochs': 17, 'patience': 5}
[    random] t= 388s  evals=   25  best_val=0.89900  params={'batch_size': 256, 'lr': 0.0003019576280099601, 'weight_decay': 0.00025258413428440015, 'optimizer': 'adam', 'momentum': 0.0, 'h1': 674, 'h2': 129, 'dropout': 0.23086038700470002, 'max_epochs': 17, 'patience': 5}
[    random] t= 414s  evals=   26  best_val=0.89900  params={'batch_size': 256, 'lr': 0.0003019576280099601, 'weight_decay': 0.00025258413428440015, 'optimizer': 'adam', 'momentum': 0.0, 'h1': 674, 'h2': 129, 'dropout': 0.23086038700470002, 'max_epochs': 17, 'patience': 5}
[    random] t= 434s  evals=   28  best_val=0.89900  params={'batch_size': 256, 'lr': 0.0003019576280099601, 'weight_decay': 0.00025258413428440015, 'optimizer': 'adam', 'momentum': 0.0, 'h1': 674, 'h2': 129, 'dropout': 0.23086038700470002, 'max_epochs': 17, 'patience': 5}
[    random] t= 448s  evals=   29  best_val=0.89900  params={'batch_size': 256, 'lr': 0.0003019576280099601, 'weight_decay': 0.00025258413428440015, 'optimizer': 'adam', 'momentum': 0.0, 'h1': 674, 'h2': 129, 'dropout': 0.23086038700470002, 'max_epochs': 17, 'patience': 5}
[    random] t= 472s  evals=   30  best_val=0.89900  params={'batch_size': 256, 'lr': 0.0003019576280099601, 'weight_decay': 0.00025258413428440015, 'optimizer': 'adam', 'momentum': 0.0, 'h1': 674, 'h2': 129, 'dropout': 0.23086038700470002, 'max_epochs': 17, 'patience': 5}
[    random] t= 517s  evals=   32  best_val=0.89900  params={'batch_size': 256, 'lr': 0.0003019576280099601, 'weight_decay': 0.00025258413428440015, 'optimizer': 'adam', 'momentum': 0.0, 'h1': 674, 'h2': 129, 'dropout': 0.23086038700470002, 'max_epochs': 17, 'patience': 5}
[    random] t= 531s  evals=   33  best_val=0.89900  params={'batch_size': 256, 'lr': 0.0003019576280099601, 'weight_decay': 0.00025258413428440015, 'optimizer': 'adam', 'momentum': 0.0, 'h1': 674, 'h2': 129, 'dropout': 0.23086038700470002, 'max_epochs': 17, 'patience': 5}
[    random] t= 543s  evals=   35  best_val=0.89900  params={'batch_size': 256, 'lr': 0.0003019576280099601, 'weight_decay': 0.00025258413428440015, 'optimizer': 'adam', 'momentum': 0.0, 'h1': 674, 'h2': 129, 'dropout': 0.23086038700470002, 'max_epochs': 17, 'patience': 5}
[    random] t= 567s  evals=   36  best_val=0.89900  params={'batch_size': 256, 'lr': 0.0003019576280099601, 'weight_decay': 0.00025258413428440015, 'optimizer': 'adam', 'momentum': 0.0, 'h1': 674, 'h2': 129, 'dropout': 0.23086038700470002, 'max_epochs': 17, 'patience': 5}
[    random] t= 586s  evals=   38  best_val=0.89900  params={'batch_size': 256, 'lr': 0.0003019576280099601, 'weight_decay': 0.00025258413428440015, 'optimizer': 'adam', 'momentum': 0.0, 'h1': 674, 'h2': 129, 'dropout': 0.23086038700470002, 'max_epochs': 17, 'patience': 5}
[    random] t= 634s  evals=   40  best_val=0.89900  params={'batch_size': 256, 'lr': 0.0003019576280099601, 'weight_decay': 0.00025258413428440015, 'optimizer': 'adam', 'momentum': 0.0, 'h1': 674, 'h2': 129, 'dropout': 0.23086038700470002, 'max_epochs': 17, 'patience': 5}
[    random] t= 652s  evals=   41  best_val=0.89900  params={'batch_size': 256, 'lr': 0.0003019576280099601, 'weight_decay': 0.00025258413428440015, 'optimizer': 'adam', 'momentum': 0.0, 'h1': 674, 'h2': 129, 'dropout': 0.23086038700470002, 'max_epochs': 17, 'patience': 5}
[    random] t= 736s  evals=   42  best_val=0.89900  params={'batch_size': 256, 'lr': 0.0003019576280099601, 'weight_decay': 0.00025258413428440015, 'optimizer': 'adam', 'momentum': 0.0, 'h1': 674, 'h2': 129, 'dropout': 0.23086038700470002, 'max_epochs': 17, 'patience': 5}
[    random] t= 747s  evals=   44  best_val=0.89900  params={'batch_size': 256, 'lr': 0.0003019576280099601, 'weight_decay': 0.00025258413428440015, 'optimizer': 'adam', 'momentum': 0.0, 'h1': 674, 'h2': 129, 'dropout': 0.23086038700470002, 'max_epochs': 17, 'patience': 5}
[    random] t= 763s  evals=   45  best_val=0.89900  params={'batch_size': 256, 'lr': 0.0003019576280099601, 'weight_decay': 0.00025258413428440015, 'optimizer': 'adam', 'momentum': 0.0, 'h1': 674, 'h2': 129, 'dropout': 0.23086038700470002, 'max_epochs': 17, 'patience': 5}
[    random] t= 802s  evals=   46  best_val=0.89900  params={'batch_size': 256, 'lr': 0.0003019576280099601, 'weight_decay': 0.00025258413428440015, 'optimizer': 'adam', 'momentum': 0.0, 'h1': 674, 'h2': 129, 'dropout': 0.23086038700470002, 'max_epochs': 17, 'patience': 5}
[    random] t= 819s  evals=   47  best_val=0.89900  params={'batch_size': 256, 'lr': 0.0003019576280099601, 'weight_decay': 0.00025258413428440015, 'optimizer': 'adam', 'momentum': 0.0, 'h1': 674, 'h2': 129, 'dropout': 0.23086038700470002, 'max_epochs': 17, 'patience': 5}
[    random] t= 856s  evals=   49  best_val=0.89900  params={'batch_size': 256, 'lr': 0.0003019576280099601, 'weight_decay': 0.00025258413428440015, 'optimizer': 'adam', 'momentum': 0.0, 'h1': 674, 'h2': 129, 'dropout': 0.23086038700470002, 'max_epochs': 17, 'patience': 5}
[    random] t= 872s  evals=   50  best_val=0.89900  params={'batch_size': 256, 'lr': 0.0003019576280099601, 'weight_decay': 0.00025258413428440015, 'optimizer': 'adam', 'momentum': 0.0, 'h1': 674, 'h2': 129, 'dropout': 0.23086038700470002, 'max_epochs': 17, 'patience': 5}
/blue/ruogu.fang/junfu.cheng/.conda/envs/ml_exp_torch/lib/python3.14/site-packages/sklearn/gaussian_process/kernels.py:440: ConvergenceWarning: The optimal value found for dimension 0 of parameter k2__noise_level is close to the specified lower bound 1e-05. Decreasing the bound and calling fit again may find a better value.
  warnings.warn(
/blue/ruogu.fang/junfu.cheng/.conda/envs/ml_exp_torch/lib/python3.14/site-packages/sklearn/gaussian_process/kernels.py:440: ConvergenceWarning: The optimal value found for dimension 0 of parameter k2__noise_level is close to the specified lower bound 1e-05. Decreasing the bound and calling fit again may find a better value.
  warnings.warn(
/blue/ruogu.fang/junfu.cheng/.conda/envs/ml_exp_torch/lib/python3.14/site-packages/torch/utils/data/dataloader.py:668: UserWarning: 'pin_memory' argument is set as true but no accelerator is found, then device pinned memory won't be used.
  warnings.warn(warn_msg)
[    random] t= 890s  evals=   51  best_val=0.89900  params={'batch_size': 256, 'lr': 0.0003019576280099601, 'weight_decay': 0.00025258413428440015, 'optimizer': 'adam', 'momentum': 0.0, 'h1': 674, 'h2': 129, 'dropout': 0.23086038700470002, 'max_epochs': 17, 'patience': 5}
[    random] DONE  t=911.8s  evals=51  best_val=0.89900  params={'batch_size': 256, 'lr': 0.0003019576280099601, 'weight_decay': 0.00025258413428440015, 'optimizer': 'adam', 'momentum': 0.0, 'h1': 674, 'h2': 129, 'dropout': 0.23086038700470002, 'max_epochs': 17, 'patience': 5}
/blue/ruogu.fang/junfu.cheng/.conda/envs/ml_exp_torch/lib/python3.14/site-packages/sklearn/gaussian_process/kernels.py:440: ConvergenceWarning: The optimal value found for dimension 0 of parameter k2__noise_level is close to the specified lower bound 1e-05. Decreasing the bound and calling fit again may find a better value.
  warnings.warn(
/blue/ruogu.fang/junfu.cheng/.conda/envs/ml_exp_torch/lib/python3.14/site-packages/torch/utils/data/dataloader.py:668: UserWarning: 'pin_memory' argument is set as true but no accelerator is found, then device pinned memory won't be used.
  warnings.warn(warn_msg)
/blue/ruogu.fang/junfu.cheng/.conda/envs/ml_exp_torch/lib/python3.14/site-packages/sklearn/gaussian_process/kernels.py:440: ConvergenceWarning: The optimal value found for dimension 0 of parameter k2__noise_level is close to the specified lower bound 1e-05. Decreasing the bound and calling fit again may find a better value.
  warnings.warn(
/blue/ruogu.fang/junfu.cheng/.conda/envs/ml_exp_torch/lib/python3.14/site-packages/torch/utils/data/dataloader.py:668: UserWarning: 'pin_memory' argument is set as true but no accelerator is found, then device pinned memory won't be used.
  warnings.warn(warn_msg)
[     bayes] t=  20s  evals=   15  best_val=0.89900  params={'batch_size': 256, 'lr': 0.0003019576280099601, 'weight_decay': 0.00025258413428440015, 'optimizer': 'adam', 'momentum': 0.0, 'h1': 674, 'h2': 129, 'dropout': 0.23086038700470002, 'max_epochs': 17, 'patience': 5}
/blue/ruogu.fang/junfu.cheng/.conda/envs/ml_exp_torch/lib/python3.14/site-packages/sklearn/gaussian_process/kernels.py:440: ConvergenceWarning: The optimal value found for dimension 0 of parameter k2__noise_level is close to the specified lower bound 1e-05. Decreasing the bound and calling fit again may find a better value.
  warnings.warn(
/blue/ruogu.fang/junfu.cheng/.conda/envs/ml_exp_torch/lib/python3.14/site-packages/torch/utils/data/dataloader.py:668: UserWarning: 'pin_memory' argument is set as true but no accelerator is found, then device pinned memory won't be used.
  warnings.warn(warn_msg)
[     bayes] t=  67s  evals=   16  best_val=0.89900  params={'batch_size': 256, 'lr': 0.0003019576280099601, 'weight_decay': 0.00025258413428440015, 'optimizer': 'adam', 'momentum': 0.0, 'h1': 674, 'h2': 129, 'dropout': 0.23086038700470002, 'max_epochs': 17, 'patience': 5}
/blue/ruogu.fang/junfu.cheng/.conda/envs/ml_exp_torch/lib/python3.14/site-packages/sklearn/gaussian_process/kernels.py:440: ConvergenceWarning: The optimal value found for dimension 0 of parameter k2__noise_level is close to the specified lower bound 1e-05. Decreasing the bound and calling fit again may find a better value.
  warnings.warn(
/blue/ruogu.fang/junfu.cheng/.conda/envs/ml_exp_torch/lib/python3.14/site-packages/torch/utils/data/dataloader.py:668: UserWarning: 'pin_memory' argument is set as true but no accelerator is found, then device pinned memory won't be used.
  warnings.warn(warn_msg)
[     bayes] t=  98s  evals=   17  best_val=0.89900  params={'batch_size': 256, 'lr': 0.0003019576280099601, 'weight_decay': 0.00025258413428440015, 'optimizer': 'adam', 'momentum': 0.0, 'h1': 674, 'h2': 129, 'dropout': 0.23086038700470002, 'max_epochs': 17, 'patience': 5}
/blue/ruogu.fang/junfu.cheng/.conda/envs/ml_exp_torch/lib/python3.14/site-packages/sklearn/gaussian_process/kernels.py:440: ConvergenceWarning: The optimal value found for dimension 0 of parameter k2__noise_level is close to the specified lower bound 1e-05. Decreasing the bound and calling fit again may find a better value.
  warnings.warn(
/blue/ruogu.fang/junfu.cheng/.conda/envs/ml_exp_torch/lib/python3.14/site-packages/torch/utils/data/dataloader.py:668: UserWarning: 'pin_memory' argument is set as true but no accelerator is found, then device pinned memory won't be used.
  warnings.warn(warn_msg)
[     bayes] t= 138s  evals=   18  best_val=0.89900  params={'batch_size': 256, 'lr': 0.0003019576280099601, 'weight_decay': 0.00025258413428440015, 'optimizer': 'adam', 'momentum': 0.0, 'h1': 674, 'h2': 129, 'dropout': 0.23086038700470002, 'max_epochs': 17, 'patience': 5}
/blue/ruogu.fang/junfu.cheng/.conda/envs/ml_exp_torch/lib/python3.14/site-packages/sklearn/gaussian_process/kernels.py:440: ConvergenceWarning: The optimal value found for dimension 0 of parameter k2__noise_level is close to the specified lower bound 1e-05. Decreasing the bound and calling fit again may find a better value.
  warnings.warn(
/blue/ruogu.fang/junfu.cheng/.conda/envs/ml_exp_torch/lib/python3.14/site-packages/torch/utils/data/dataloader.py:668: UserWarning: 'pin_memory' argument is set as true but no accelerator is found, then device pinned memory won't be used.
  warnings.warn(warn_msg)
[     bayes] t= 182s  evals=   19  best_val=0.89900  params={'batch_size': 256, 'lr': 0.0003019576280099601, 'weight_decay': 0.00025258413428440015, 'optimizer': 'adam', 'momentum': 0.0, 'h1': 674, 'h2': 129, 'dropout': 0.23086038700470002, 'max_epochs': 17, 'patience': 5}
/blue/ruogu.fang/junfu.cheng/.conda/envs/ml_exp_torch/lib/python3.14/site-packages/sklearn/gaussian_process/kernels.py:440: ConvergenceWarning: The optimal value found for dimension 0 of parameter k2__noise_level is close to the specified lower bound 1e-05. Decreasing the bound and calling fit again may find a better value.
  warnings.warn(
/blue/ruogu.fang/junfu.cheng/.conda/envs/ml_exp_torch/lib/python3.14/site-packages/torch/utils/data/dataloader.py:668: UserWarning: 'pin_memory' argument is set as true but no accelerator is found, then device pinned memory won't be used.
  warnings.warn(warn_msg)
[     bayes] t= 195s  evals=   20  best_val=0.89900  params={'batch_size': 256, 'lr': 0.0003019576280099601, 'weight_decay': 0.00025258413428440015, 'optimizer': 'adam', 'momentum': 0.0, 'h1': 674, 'h2': 129, 'dropout': 0.23086038700470002, 'max_epochs': 17, 'patience': 5}
/blue/ruogu.fang/junfu.cheng/.conda/envs/ml_exp_torch/lib/python3.14/site-packages/sklearn/gaussian_process/kernels.py:440: ConvergenceWarning: The optimal value found for dimension 0 of parameter k2__noise_level is close to the specified lower bound 1e-05. Decreasing the bound and calling fit again may find a better value.
  warnings.warn(
/blue/ruogu.fang/junfu.cheng/.conda/envs/ml_exp_torch/lib/python3.14/site-packages/torch/utils/data/dataloader.py:668: UserWarning: 'pin_memory' argument is set as true but no accelerator is found, then device pinned memory won't be used.
  warnings.warn(warn_msg)
[     bayes] t= 238s  evals=   21  best_val=0.89900  params={'batch_size': 256, 'lr': 0.0003019576280099601, 'weight_decay': 0.00025258413428440015, 'optimizer': 'adam', 'momentum': 0.0, 'h1': 674, 'h2': 129, 'dropout': 0.23086038700470002, 'max_epochs': 17, 'patience': 5}
/blue/ruogu.fang/junfu.cheng/.conda/envs/ml_exp_torch/lib/python3.14/site-packages/sklearn/gaussian_process/kernels.py:440: ConvergenceWarning: The optimal value found for dimension 0 of parameter k2__noise_level is close to the specified lower bound 1e-05. Decreasing the bound and calling fit again may find a better value.
  warnings.warn(
/blue/ruogu.fang/junfu.cheng/.conda/envs/ml_exp_torch/lib/python3.14/site-packages/torch/utils/data/dataloader.py:668: UserWarning: 'pin_memory' argument is set as true but no accelerator is found, then device pinned memory won't be used.
  warnings.warn(warn_msg)
[     bayes] t= 251s  evals=   22  best_val=0.89900  params={'batch_size': 256, 'lr': 0.0003019576280099601, 'weight_decay': 0.00025258413428440015, 'optimizer': 'adam', 'momentum': 0.0, 'h1': 674, 'h2': 129, 'dropout': 0.23086038700470002, 'max_epochs': 17, 'patience': 5}
/blue/ruogu.fang/junfu.cheng/.conda/envs/ml_exp_torch/lib/python3.14/site-packages/sklearn/gaussian_process/kernels.py:440: ConvergenceWarning: The optimal value found for dimension 0 of parameter k2__noise_level is close to the specified lower bound 1e-05. Decreasing the bound and calling fit again may find a better value.
  warnings.warn(
/blue/ruogu.fang/junfu.cheng/.conda/envs/ml_exp_torch/lib/python3.14/site-packages/torch/utils/data/dataloader.py:668: UserWarning: 'pin_memory' argument is set as true but no accelerator is found, then device pinned memory won't be used.
  warnings.warn(warn_msg)
[     bayes] t= 302s  evals=   23  best_val=0.89900  params={'batch_size': 256, 'lr': 0.0003019576280099601, 'weight_decay': 0.00025258413428440015, 'optimizer': 'adam', 'momentum': 0.0, 'h1': 674, 'h2': 129, 'dropout': 0.23086038700470002, 'max_epochs': 17, 'patience': 5}
/blue/ruogu.fang/junfu.cheng/.conda/envs/ml_exp_torch/lib/python3.14/site-packages/sklearn/gaussian_process/kernels.py:440: ConvergenceWarning: The optimal value found for dimension 0 of parameter k2__noise_level is close to the specified lower bound 1e-05. Decreasing the bound and calling fit again may find a better value.
  warnings.warn(
/blue/ruogu.fang/junfu.cheng/.conda/envs/ml_exp_torch/lib/python3.14/site-packages/torch/utils/data/dataloader.py:668: UserWarning: 'pin_memory' argument is set as true but no accelerator is found, then device pinned memory won't be used.
  warnings.warn(warn_msg)
[     bayes] t= 316s  evals=   24  best_val=0.89900  params={'batch_size': 256, 'lr': 0.0003019576280099601, 'weight_decay': 0.00025258413428440015, 'optimizer': 'adam', 'momentum': 0.0, 'h1': 674, 'h2': 129, 'dropout': 0.23086038700470002, 'max_epochs': 17, 'patience': 5}
/blue/ruogu.fang/junfu.cheng/.conda/envs/ml_exp_torch/lib/python3.14/site-packages/sklearn/gaussian_process/kernels.py:440: ConvergenceWarning: The optimal value found for dimension 0 of parameter k2__noise_level is close to the specified lower bound 1e-05. Decreasing the bound and calling fit again may find a better value.
  warnings.warn(
/blue/ruogu.fang/junfu.cheng/.conda/envs/ml_exp_torch/lib/python3.14/site-packages/torch/utils/data/dataloader.py:668: UserWarning: 'pin_memory' argument is set as true but no accelerator is found, then device pinned memory won't be used.
  warnings.warn(warn_msg)
[     bayes] t= 330s  evals=   25  best_val=0.89900  params={'batch_size': 256, 'lr': 0.0003019576280099601, 'weight_decay': 0.00025258413428440015, 'optimizer': 'adam', 'momentum': 0.0, 'h1': 674, 'h2': 129, 'dropout': 0.23086038700470002, 'max_epochs': 17, 'patience': 5}
/blue/ruogu.fang/junfu.cheng/.conda/envs/ml_exp_torch/lib/python3.14/site-packages/sklearn/gaussian_process/kernels.py:440: ConvergenceWarning: The optimal value found for dimension 0 of parameter k2__noise_level is close to the specified lower bound 1e-05. Decreasing the bound and calling fit again may find a better value.
  warnings.warn(
/blue/ruogu.fang/junfu.cheng/.conda/envs/ml_exp_torch/lib/python3.14/site-packages/torch/utils/data/dataloader.py:668: UserWarning: 'pin_memory' argument is set as true but no accelerator is found, then device pinned memory won't be used.
  warnings.warn(warn_msg)
[     bayes] t= 386s  evals=   26  best_val=0.89900  params={'batch_size': 256, 'lr': 0.0003019576280099601, 'weight_decay': 0.00025258413428440015, 'optimizer': 'adam', 'momentum': 0.0, 'h1': 674, 'h2': 129, 'dropout': 0.23086038700470002, 'max_epochs': 17, 'patience': 5}
/blue/ruogu.fang/junfu.cheng/.conda/envs/ml_exp_torch/lib/python3.14/site-packages/sklearn/gaussian_process/kernels.py:440: ConvergenceWarning: The optimal value found for dimension 0 of parameter k2__noise_level is close to the specified lower bound 1e-05. Decreasing the bound and calling fit again may find a better value.
  warnings.warn(
/blue/ruogu.fang/junfu.cheng/.conda/envs/ml_exp_torch/lib/python3.14/site-packages/torch/utils/data/dataloader.py:668: UserWarning: 'pin_memory' argument is set as true but no accelerator is found, then device pinned memory won't be used.
  warnings.warn(warn_msg)
[     bayes] t= 412s  evals=   27  best_val=0.89900  params={'batch_size': 256, 'lr': 0.0003019576280099601, 'weight_decay': 0.00025258413428440015, 'optimizer': 'adam', 'momentum': 0.0, 'h1': 674, 'h2': 129, 'dropout': 0.23086038700470002, 'max_epochs': 17, 'patience': 5}
/blue/ruogu.fang/junfu.cheng/.conda/envs/ml_exp_torch/lib/python3.14/site-packages/sklearn/gaussian_process/kernels.py:440: ConvergenceWarning: The optimal value found for dimension 0 of parameter k2__noise_level is close to the specified lower bound 1e-05. Decreasing the bound and calling fit again may find a better value.
  warnings.warn(
/blue/ruogu.fang/junfu.cheng/.conda/envs/ml_exp_torch/lib/python3.14/site-packages/torch/utils/data/dataloader.py:668: UserWarning: 'pin_memory' argument is set as true but no accelerator is found, then device pinned memory won't be used.
  warnings.warn(warn_msg)
[     bayes] t= 441s  evals=   28  best_val=0.89900  params={'batch_size': 256, 'lr': 0.0003019576280099601, 'weight_decay': 0.00025258413428440015, 'optimizer': 'adam', 'momentum': 0.0, 'h1': 674, 'h2': 129, 'dropout': 0.23086038700470002, 'max_epochs': 17, 'patience': 5}
/blue/ruogu.fang/junfu.cheng/.conda/envs/ml_exp_torch/lib/python3.14/site-packages/sklearn/gaussian_process/kernels.py:440: ConvergenceWarning: The optimal value found for dimension 0 of parameter k2__noise_level is close to the specified lower bound 1e-05. Decreasing the bound and calling fit again may find a better value.
  warnings.warn(
/blue/ruogu.fang/junfu.cheng/.conda/envs/ml_exp_torch/lib/python3.14/site-packages/torch/utils/data/dataloader.py:668: UserWarning: 'pin_memory' argument is set as true but no accelerator is found, then device pinned memory won't be used.
  warnings.warn(warn_msg)
[     bayes] t= 462s  evals=   29  best_val=0.89900  params={'batch_size': 256, 'lr': 0.0003019576280099601, 'weight_decay': 0.00025258413428440015, 'optimizer': 'adam', 'momentum': 0.0, 'h1': 674, 'h2': 129, 'dropout': 0.23086038700470002, 'max_epochs': 17, 'patience': 5}
/blue/ruogu.fang/junfu.cheng/.conda/envs/ml_exp_torch/lib/python3.14/site-packages/sklearn/gaussian_process/kernels.py:440: ConvergenceWarning: The optimal value found for dimension 0 of parameter k2__noise_level is close to the specified lower bound 1e-05. Decreasing the bound and calling fit again may find a better value.
  warnings.warn(
/blue/ruogu.fang/junfu.cheng/.conda/envs/ml_exp_torch/lib/python3.14/site-packages/torch/utils/data/dataloader.py:668: UserWarning: 'pin_memory' argument is set as true but no accelerator is found, then device pinned memory won't be used.
  warnings.warn(warn_msg)
[     bayes] t= 484s  evals=   30  best_val=0.89900  params={'batch_size': 256, 'lr': 0.0003019576280099601, 'weight_decay': 0.00025258413428440015, 'optimizer': 'adam', 'momentum': 0.0, 'h1': 674, 'h2': 129, 'dropout': 0.23086038700470002, 'max_epochs': 17, 'patience': 5}
/blue/ruogu.fang/junfu.cheng/.conda/envs/ml_exp_torch/lib/python3.14/site-packages/sklearn/gaussian_process/kernels.py:440: ConvergenceWarning: The optimal value found for dimension 0 of parameter k2__noise_level is close to the specified lower bound 1e-05. Decreasing the bound and calling fit again may find a better value.
  warnings.warn(
/blue/ruogu.fang/junfu.cheng/.conda/envs/ml_exp_torch/lib/python3.14/site-packages/torch/utils/data/dataloader.py:668: UserWarning: 'pin_memory' argument is set as true but no accelerator is found, then device pinned memory won't be used.
  warnings.warn(warn_msg)
[     bayes] t= 596s  evals=   31  best_val=0.89900  params={'batch_size': 256, 'lr': 0.0003019576280099601, 'weight_decay': 0.00025258413428440015, 'optimizer': 'adam', 'momentum': 0.0, 'h1': 674, 'h2': 129, 'dropout': 0.23086038700470002, 'max_epochs': 17, 'patience': 5}
/blue/ruogu.fang/junfu.cheng/.conda/envs/ml_exp_torch/lib/python3.14/site-packages/sklearn/gaussian_process/kernels.py:440: ConvergenceWarning: The optimal value found for dimension 0 of parameter k2__noise_level is close to the specified lower bound 1e-05. Decreasing the bound and calling fit again may find a better value.
  warnings.warn(
/blue/ruogu.fang/junfu.cheng/.conda/envs/ml_exp_torch/lib/python3.14/site-packages/torch/utils/data/dataloader.py:668: UserWarning: 'pin_memory' argument is set as true but no accelerator is found, then device pinned memory won't be used.
  warnings.warn(warn_msg)
[     bayes] t= 638s  evals=   32  best_val=0.89900  params={'batch_size': 256, 'lr': 0.0003019576280099601, 'weight_decay': 0.00025258413428440015, 'optimizer': 'adam', 'momentum': 0.0, 'h1': 674, 'h2': 129, 'dropout': 0.23086038700470002, 'max_epochs': 17, 'patience': 5}
/blue/ruogu.fang/junfu.cheng/.conda/envs/ml_exp_torch/lib/python3.14/site-packages/sklearn/gaussian_process/kernels.py:440: ConvergenceWarning: The optimal value found for dimension 0 of parameter k2__noise_level is close to the specified lower bound 1e-05. Decreasing the bound and calling fit again may find a better value.
  warnings.warn(
/blue/ruogu.fang/junfu.cheng/.conda/envs/ml_exp_torch/lib/python3.14/site-packages/torch/utils/data/dataloader.py:668: UserWarning: 'pin_memory' argument is set as true but no accelerator is found, then device pinned memory won't be used.
  warnings.warn(warn_msg)
[     bayes] t= 670s  evals=   33  best_val=0.89900  params={'batch_size': 256, 'lr': 0.0003019576280099601, 'weight_decay': 0.00025258413428440015, 'optimizer': 'adam', 'momentum': 0.0, 'h1': 674, 'h2': 129, 'dropout': 0.23086038700470002, 'max_epochs': 17, 'patience': 5}
/blue/ruogu.fang/junfu.cheng/.conda/envs/ml_exp_torch/lib/python3.14/site-packages/sklearn/gaussian_process/kernels.py:440: ConvergenceWarning: The optimal value found for dimension 0 of parameter k2__noise_level is close to the specified lower bound 1e-05. Decreasing the bound and calling fit again may find a better value.
  warnings.warn(
/blue/ruogu.fang/junfu.cheng/.conda/envs/ml_exp_torch/lib/python3.14/site-packages/torch/utils/data/dataloader.py:668: UserWarning: 'pin_memory' argument is set as true but no accelerator is found, then device pinned memory won't be used.
  warnings.warn(warn_msg)
[     bayes] t= 732s  evals=   34  best_val=0.89900  params={'batch_size': 256, 'lr': 0.0003019576280099601, 'weight_decay': 0.00025258413428440015, 'optimizer': 'adam', 'momentum': 0.0, 'h1': 674, 'h2': 129, 'dropout': 0.23086038700470002, 'max_epochs': 17, 'patience': 5}
/blue/ruogu.fang/junfu.cheng/.conda/envs/ml_exp_torch/lib/python3.14/site-packages/sklearn/gaussian_process/kernels.py:440: ConvergenceWarning: The optimal value found for dimension 0 of parameter k2__noise_level is close to the specified lower bound 1e-05. Decreasing the bound and calling fit again may find a better value.
  warnings.warn(
/blue/ruogu.fang/junfu.cheng/.conda/envs/ml_exp_torch/lib/python3.14/site-packages/torch/utils/data/dataloader.py:668: UserWarning: 'pin_memory' argument is set as true but no accelerator is found, then device pinned memory won't be used.
  warnings.warn(warn_msg)
[     bayes] t= 825s  evals=   36  best_val=0.89900  params={'batch_size': 256, 'lr': 0.0003019576280099601, 'weight_decay': 0.00025258413428440015, 'optimizer': 'adam', 'momentum': 0.0, 'h1': 674, 'h2': 129, 'dropout': 0.23086038700470002, 'max_epochs': 17, 'patience': 5}
[     bayes] DONE  t=910.9s  evals=36  best_val=0.89900  params={'batch_size': 256, 'lr': 0.0003019576280099601, 'weight_decay': 0.00025258413428440015, 'optimizer': 'adam', 'momentum': 0.0, 'h1': 674, 'h2': 129, 'dropout': 0.23086038700470002, 'max_epochs': 17, 'patience': 5}
[   genetic] t=  12s  evals=   20  best_val=0.89900  params={'batch_size': 256, 'lr': 0.0003019576280099601, 'weight_decay': 0.00025258413428440015, 'optimizer': 'adam', 'momentum': 0.0, 'h1': 674, 'h2': 129, 'dropout': 0.23086038700470002, 'max_epochs': 17, 'patience': 5}
[   genetic] t=  64s  evals=   22  best_val=0.89900  params={'batch_size': 256, 'lr': 0.0003019576280099601, 'weight_decay': 0.00025258413428440015, 'optimizer': 'adam', 'momentum': 0.0, 'h1': 674, 'h2': 129, 'dropout': 0.23086038700470002, 'max_epochs': 17, 'patience': 5}
[   genetic] t= 105s  evals=   23  best_val=0.89900  params={'batch_size': 256, 'lr': 0.0003019576280099601, 'weight_decay': 0.00025258413428440015, 'optimizer': 'adam', 'momentum': 0.0, 'h1': 674, 'h2': 129, 'dropout': 0.23086038700470002, 'max_epochs': 17, 'patience': 5}
[   genetic] t= 141s  evals=   24  best_val=0.89900  params={'batch_size': 256, 'lr': 0.0003019576280099601, 'weight_decay': 0.00025258413428440015, 'optimizer': 'adam', 'momentum': 0.0, 'h1': 674, 'h2': 129, 'dropout': 0.23086038700470002, 'max_epochs': 17, 'patience': 5}
[   genetic] t= 171s  evals=   25  best_val=0.89900  params={'batch_size': 256, 'lr': 0.0003019576280099601, 'weight_decay': 0.00025258413428440015, 'optimizer': 'adam', 'momentum': 0.0, 'h1': 674, 'h2': 129, 'dropout': 0.23086038700470002, 'max_epochs': 17, 'patience': 5}
[   genetic] t= 210s  evals=   26  best_val=0.89900  params={'batch_size': 256, 'lr': 0.0003019576280099601, 'weight_decay': 0.00025258413428440015, 'optimizer': 'adam', 'momentum': 0.0, 'h1': 674, 'h2': 129, 'dropout': 0.23086038700470002, 'max_epochs': 17, 'patience': 5}
[   genetic] t= 233s  evals=   27  best_val=0.90052  params={'batch_size': 256, 'lr': 0.0003019576280099601, 'weight_decay': 1e-07, 'optimizer': 'adam', 'momentum': 0.0, 'h1': 1015, 'h2': 493, 'dropout': 0.22206739333049713, 'max_epochs': 17, 'patience': 5}
[   genetic] t= 320s  evals=   28  best_val=0.90052  params={'batch_size': 256, 'lr': 0.0003019576280099601, 'weight_decay': 1e-07, 'optimizer': 'adam', 'momentum': 0.0, 'h1': 1015, 'h2': 493, 'dropout': 0.22206739333049713, 'max_epochs': 17, 'patience': 5}
[   genetic] t= 347s  evals=   29  best_val=0.90052  params={'batch_size': 256, 'lr': 0.0003019576280099601, 'weight_decay': 1e-07, 'optimizer': 'adam', 'momentum': 0.0, 'h1': 1015, 'h2': 493, 'dropout': 0.22206739333049713, 'max_epochs': 17, 'patience': 5}
[   genetic] t= 358s  evals=   30  best_val=0.90052  params={'batch_size': 256, 'lr': 0.0003019576280099601, 'weight_decay': 1e-07, 'optimizer': 'adam', 'momentum': 0.0, 'h1': 1015, 'h2': 493, 'dropout': 0.22206739333049713, 'max_epochs': 17, 'patience': 5}
[   genetic] t= 379s  evals=   31  best_val=0.90052  params={'batch_size': 256, 'lr': 0.0003019576280099601, 'weight_decay': 1e-07, 'optimizer': 'adam', 'momentum': 0.0, 'h1': 1015, 'h2': 493, 'dropout': 0.22206739333049713, 'max_epochs': 17, 'patience': 5}
[   genetic] t= 392s  evals=   32  best_val=0.90052  params={'batch_size': 256, 'lr': 0.0003019576280099601, 'weight_decay': 1e-07, 'optimizer': 'adam', 'momentum': 0.0, 'h1': 1015, 'h2': 493, 'dropout': 0.22206739333049713, 'max_epochs': 17, 'patience': 5}
[   genetic] t= 441s  evals=   33  best_val=0.90052  params={'batch_size': 256, 'lr': 0.0003019576280099601, 'weight_decay': 1e-07, 'optimizer': 'adam', 'momentum': 0.0, 'h1': 1015, 'h2': 493, 'dropout': 0.22206739333049713, 'max_epochs': 17, 'patience': 5}
[   genetic] t= 485s  evals=   34  best_val=0.90052  params={'batch_size': 256, 'lr': 0.0003019576280099601, 'weight_decay': 1e-07, 'optimizer': 'adam', 'momentum': 0.0, 'h1': 1015, 'h2': 493, 'dropout': 0.22206739333049713, 'max_epochs': 17, 'patience': 5}
[   genetic] t= 547s  evals=   35  best_val=0.90052  params={'batch_size': 256, 'lr': 0.0003019576280099601, 'weight_decay': 1e-07, 'optimizer': 'adam', 'momentum': 0.0, 'h1': 1015, 'h2': 493, 'dropout': 0.22206739333049713, 'max_epochs': 17, 'patience': 5}
[   genetic] t= 580s  evals=   36  best_val=0.90052  params={'batch_size': 256, 'lr': 0.0003019576280099601, 'weight_decay': 1e-07, 'optimizer': 'adam', 'momentum': 0.0, 'h1': 1015, 'h2': 493, 'dropout': 0.22206739333049713, 'max_epochs': 17, 'patience': 5}
[   genetic] t= 628s  evals=   37  best_val=0.90052  params={'batch_size': 256, 'lr': 0.0003019576280099601, 'weight_decay': 1e-07, 'optimizer': 'adam', 'momentum': 0.0, 'h1': 1015, 'h2': 493, 'dropout': 0.22206739333049713, 'max_epochs': 17, 'patience': 5}
[   genetic] t= 640s  evals=   38  best_val=0.90052  params={'batch_size': 256, 'lr': 0.0003019576280099601, 'weight_decay': 1e-07, 'optimizer': 'adam', 'momentum': 0.0, 'h1': 1015, 'h2': 493, 'dropout': 0.22206739333049713, 'max_epochs': 17, 'patience': 5}
[   genetic] t= 658s  evals=   39  best_val=0.90052  params={'batch_size': 256, 'lr': 0.0003019576280099601, 'weight_decay': 1e-07, 'optimizer': 'adam', 'momentum': 0.0, 'h1': 1015, 'h2': 493, 'dropout': 0.22206739333049713, 'max_epochs': 17, 'patience': 5}
[   genetic] t= 692s  evals=   40  best_val=0.90052  params={'batch_size': 256, 'lr': 0.0003019576280099601, 'weight_decay': 1e-07, 'optimizer': 'adam', 'momentum': 0.0, 'h1': 1015, 'h2': 493, 'dropout': 0.22206739333049713, 'max_epochs': 17, 'patience': 5}
[   genetic] t= 722s  evals=   41  best_val=0.90052  params={'batch_size': 256, 'lr': 0.0003019576280099601, 'weight_decay': 1e-07, 'optimizer': 'adam', 'momentum': 0.0, 'h1': 1015, 'h2': 493, 'dropout': 0.22206739333049713, 'max_epochs': 17, 'patience': 5}
[   genetic] t= 785s  evals=   42  best_val=0.90052  params={'batch_size': 256, 'lr': 0.0003019576280099601, 'weight_decay': 1e-07, 'optimizer': 'adam', 'momentum': 0.0, 'h1': 1015, 'h2': 493, 'dropout': 0.22206739333049713, 'max_epochs': 17, 'patience': 5}
[   genetic] t= 870s  evals=   43  best_val=0.90052  params={'batch_size': 256, 'lr': 0.0003019576280099601, 'weight_decay': 1e-07, 'optimizer': 'adam', 'momentum': 0.0, 'h1': 1015, 'h2': 493, 'dropout': 0.22206739333049713, 'max_epochs': 17, 'patience': 5}
[   genetic] DONE  t=955.6s  evals=43  best_val=0.90052  params={'batch_size': 256, 'lr': 0.0003019576280099601, 'weight_decay': 1e-07, 'optimizer': 'adam', 'momentum': 0.0, 'h1': 1015, 'h2': 493, 'dropout': 0.22206739333049713, 'max_epochs': 17, 'patience': 5}

=== SUMMARY (best VAL accuracy within budget) ===
    grid: best_val=0.87059  evals=131  params={'batch_size': 64, 'lr': 0.0001, 'weight_decay': 0.0, 'optimizer': 'adam', 'momentum': 0.0, 'h1': 256, 'h2': 512, 'dropout': 0.0, 'max_epochs': 15, 'patience': 4}
  random: best_val=0.89900  evals=51  params={'batch_size': 256, 'lr': 0.0003019576280099601, 'weight_decay': 0.00025258413428440015, 'optimizer': 'adam', 'momentum': 0.0, 'h1': 674, 'h2': 129, 'dropout': 0.23086038700470002, 'max_epochs': 17, 'patience': 5}
   bayes: best_val=0.89900  evals=36  params={'batch_size': 256, 'lr': 0.0003019576280099601, 'weight_decay': 0.00025258413428440015, 'optimizer': 'adam', 'momentum': 0.0, 'h1': 674, 'h2': 129, 'dropout': 0.23086038700470002, 'max_epochs': 17, 'patience': 5}
 genetic: best_val=0.90052  evals=43  params={'batch_size': 256, 'lr': 0.0003019576280099601, 'weight_decay': 1e-07, 'optimizer': 'adam', 'momentum': 0.0, 'h1': 1015, 'h2': 493, 'dropout': 0.22206739333049713, 'max_epochs': 17, 'patience': 5}

=== TEST SET PERFORMANCE (retrain on TRAIN+VAL, evaluate once) ===
    grid: test_acc=0.86067
  random: test_acc=0.88750
   bayes: test_acc=0.88750
 genetic: test_acc=0.89033
